;ID_SEKCJA NADRZĘDNA;ID_SEKCJA;NAZWA_SEKCJI;TREŚĆ;DATA SFCR;WERSJA SFCR;KOD ZAKŁADU;KOD ZAKLADU;ID_TAB
101;8;11.0;B.3 System zarządzania ryzykiem, w tym własna ocena ryzyka i wypłacalności;assessment B.3.1. Description of risk management system B.3.1.1. Risk management framework Effective Risk management is based on a common understanding of Risks, clear organizational struc-tures, and comprehensively defined Risk management processes. The following principles shall serve as a basic foundation upon which EH Ré SA risk management approach shall be implemented and conducted. EH Ré SA Board of Management;01.01.1970;1;1;85;100
102;8;10.0;B.2 Wymogi dotyczące kompetencji i reputacji;B.2.1. Description of requirements for « fit & proper » The application of the Solvency 2 directive requires a high Fit and Proper standard for Senior Man-agement and Key Function Holders across the company. For these positions, a policy establishes the core principles (general principles, fitness and propriety) and processes necessary to ensure sufficient knowledge, experience and professional qualifications as well as the necessary integrity and sound-ness of judgment. Scope;01.01.1970;1;1;85;100
103;8;9.0;B.1 Informacje ogólne o systemie zarządzania;system of governance B.1.1. Structure of the system of governance For an adequate monitoring of the risks related to its activity, EH Ré SA’s management is organised around two management bodies: •;01.01.1970;1;1;85;100
104;2;7.0;A.5 Wszelkie inne informacje;information There is no other material information regarding EH Ré SA’s business and performance to be dis-closed.;01.01.1970;1;1;85;100
105;2;6.0;A.4 Wyniki z pozostałych rodzajów działalności;EH Ré SA does not have any other source of income and expenses over the reporting period. A.5. Any other information;01.01.1970;1;1;85;100
106;2;5.0;A.3 Wynik z działalności lokacyjnej;Income and expenses arising from investments IFRS figures;01.01.1970;1;1;85;100
107;2;4.0;A.2 Wynik z działalności ubezpieczeniowej;Aggregate underwriting performance The following table summarizes EH Ré SA’s underwriting performance at an aggregate level:;01.01.1970;1;1;85;100
108;2;3.0;A.1 Działalność;Business ............................................................................................................................... 10 A.1.1. Legal entity, auditor and supervisor ................................................................................. 10 Name and legal form ................................................................................................... 10 A.1.1.1. Supervisor .................................................................................................................... 10 A.1.1.2. Auditor .......................................................................................................................... 10 A.1.1.3.A.1.2. Group structure and qualified holdings ............................................................................ 10 A.1.3. Material lines of business and geographical areas ......................................................... 11 Lines of Business ........................................................................................................ 11 A.1.3.1.A.1.4. Significant events ................................................................................................................ 11 A.2. Underwriting Performance ................................................................................................. 11 A.2.1. Aggregate underwriting performance ............................................................................... 11 A.2.2. Underwriting performance by material geographical area ............................................. 12 A.3. Investment Performance ..................................................................................................... 12 A.3.1. Income and expenses arising from investments ............................................................. 12 A.3.2. Gains and losses recognized directly in equity ............................................................... 13 A.3.3. Investments in securitization ............................................................................................. 13 A.4. Performance of other activities .......................................................................................... 13 A.5. Any other information ......................................................................................................... 13 B. System of governance ................................................................................................................ 14 B.1. General information on the system of governance ......................................................... 14 B.1.1. Structure of the system of governance ............................................................................. 14 The Board of Directors (BoD) ..................................................................................... 14 B.1.1.1.B.1.1.1.1 The Audit Committee .................................................................................................. 14 B.1.1.1.2 The Financial Committee ............................................................................................ 14 B.1.1.1.2.1 The General Assembly ............................................................................................ 15 The Board of Management ......................................................................................... 15 B.1.1.2.B.1.1.2.1 The Risk Committee .................................................................................................... 15 B.1.1.2.2 The Loss Reserve Committee .................................................................................... 15 B.1.1.2.3 The Underwriting Committee ..................................................................................... 16 B.1.1.2.4 The Integrity Committee ............................................................................................. 16 Key functions ............................................................................................................... 16 B.1.1.3.B.1.1.3.1 Internal audit ................................................................................................................ 17 B.1.1.3.2 Compliance .................................................................................................................. 17 B.1.1.3.3 Risk management ........................................................................................................ 18 B.1.1.3.4 Actuarial function ........................................................................................................ 20 B.1.2. Remuneration policy ........................................................................................................... 21 Definitions .................................................................................................................... 21 B.1.2.1. Principles for Remuneration ...................................................................................... 21 B.1.2.2.B.1.2.2.1 General Remuneration Principles .............................................................................. 21 B.1.2.2.2 General Compensation Principles ............................................................................. 22 B.1.2.2.3 Specific Compensation Principles............................................................................. 22 Processes ..................................................................................................................... 23 B.1.2.3.B.1.3. Material transactions ........................................................................................................... 24 B.2. Fit and proper requirements ............................................................................................... 24 B.2.1. Description of requirements for « fit & proper » .............................................................. 24 Scope ............................................................................................................................ 24 B.2.1.1. Definitions .................................................................................................................... 25 B.2.1.2.B.2.2. Description of processes and procedures in place ......................................................... 26 Processes for ensuring Fitness and Propriety at recruitment ............................... 26 B.2.2.1. Processes for ensuring ongoing Fitness and Propriety ......................................... 27 B.2.2.2. Outsourcing of a Key Function .................................................................................. 28 B.2.2.3. Assessment results ..................................................................................................... 28 B.2.2.4. Training ......................................................................................................................... 28 B.2.2.5.B.3. Risk management system including the own risk and solvency assessment ............. 28 B.3.1. Description of risk management system .......................................................................... 28 Risk management framework ..................................................................................... 28 B.3.1.1. Risk management processes ..................................................................................... 29 B.3.1.2.EH Ré SA Solvency and Financial Condition Report page 4 of 98;01.01.1970;1;1;85;100
