;ID_SEKCJA NADRZĘDNA;ID_SEKCJA;NAZWA_SEKCJI;TREŚĆ;DATA SFCR;WERSJA SFCR;KOD ZAKŁADU;KOD ZAKLADU;ID_TAB
60;18;;C.1.6. Expected profit included in future premiums;premiums Please refer to Section C.2.6 of this report for information on the total amount of the expected profit included in future premiums. EH Ré SA Solvency and Financial Condition Report;01.01.1970;1;1;85;100
61;18;;C.1.5. Risk mitigation;mitigation As mentioned in section C.3.5, EH Ré SA reinsurance structure allows for an efficient mitigation of underwriting risk.;01.01.1970;1;1;85;100
62;18;;C.1.4. Risk concentration;concentration Please refer to Section C.3.4 for a description of the material risk concentrations to which EH Ré SA is exposed. C.1.5. Risk mitigation;01.01.1970;1;1;85;100
63;18;;C.1.3. Description of assets investment;investment Please refer to Section C.2.3 for information regarding how assets have been invested in accordance with the “prudent person principle” so that EH Ré SA’s risks, including underwriting risk, have been properly managed. C.1.4. Risk concentration;01.01.1970;1;1;85;100
64;18;;C.1.2. Description of the risk exposure;exposure EH Ré SA’s P&C underwriting risk is composed of: •;01.01.1970;1;1;85;100
65;13;;B.5.3. Independence and objectivity of the internal audit function;function In order to ensure the objectivity and the independence of the Internal Audit function, the following specific requirements have been set:;01.01.1970;1;1;85;100
66;13;;B.5.2. Internal audit framework;framework Audit Universe and Audit Plan;01.01.1970;1;1;85;100
67;12;;B.4.2. Implementation of compliance function Remit B.4.2.1.;B.4.2.1. The scope of the Compliance function at EH Ré SA is focused, albeit not exclusively, on the following areas: •;01.01.1970;1;1;85;100
68;11;;B.3.3. Description of ORSA process;process The Own Risk and Solvency Assessment (ORSA) draws upon the whole risk management system in order to conclude on the risk profile adequacy over time and different scenarios, taking into account all kinds of risk (quantitative and qualitative). Therefore, the ORSA has to be considered as being performed on an ongoing basis during normal execution of the risk management framework. This ongoing performance is complemented by a regu-lar comprehensive annual assessment and report, as well as non-regular (i.e. ad-hoc) assessment following significant changes in the risk profile. This report is dedicated to the Board of Directors of EH Ré SA and supports the decision making pro-cess. Macro process ORSA;01.01.1970;1;1;85;100
69;11;;B.3.2. Governance of the internal model B.3.2.1. Governance of the internal model The Board of Management;Management is responsible for approving the application to use the internal model to calculate the Solvency Capital Requirement. The approval is required within the scope of the initial Internal Model Approval Process (IMAP). In addition, the Board of Management is responsible for confirming the ongoing appropriateness of the internal model at least annually signing off the Annual Validation Report. A. EH Ré SA CRO;01.01.1970;1;1;85;100
70;11;;B.3.1 B.3.1.3. Three Lines of Defense ............................................................................................... 30 B.3.1.4.B.3.2. Governance of the internal model ..................................................................................... 30  Governance of the internal model ............................................................................. 30 B.3.2.1. Governance of Trade credit insurance & surety model........................................... 31 B.3.2.2. Material changes to the internal model governance ................................................ 32 B.3.2.3. Description of the validation process ....................................................................... 32 B.3.2.4.B.3.3. Description of ORSA process ............................................................................................ 33  Macro process ORSA .................................................................................................. 33 B.3.3.1. ORSA governance ....................................................................................................... 34 B.3.3.2.B.3.3.2.1 Board of Directors (BoD) ............................................................................................ 34 B.3.3.2.2 Board of Management (BoM) ...................................................................................... 34 B.3.3.2.3 Risk Committee............................................................................................................ 34 B.3.3.2.4 Chief Risk Officer......................................................................................................... 34  ORSA report review process ...................................................................................... 35 B.3.3.3. Capital management strategy .................................................................................... 35 B.3.3.4.B.4. Internal control system ....................................................................................................... 35 B.4.1. Description of internal control system .............................................................................. 35 B.4.2. Implementation of compliance function ........................................................................... 38  Remit ............................................................................................................................. 38 B.4.2.1. Internal organisation ................................................................................................... 39 B.4.2.2. How it functions ........................................................................................................... 40 B.4.2.3.B.5. Internal audit function ......................................................................................................... 41 B.5.1. Internal audit function implementation within EH Ré SA ................................................ 41 B.5.2. Internal audit framework ..................................................................................................... 41 B.5.3. Independence and objectivity of the internal audit function .......................................... 42 B.6. Actuarial function ................................................................................................................ 43 B.6.1. Implementation of the actuarial function .......................................................................... 43 B.6.2. Governance .......................................................................................................................... 43 B.6.3. Interfaces .............................................................................................................................. 44 B.7. Outsourcing ......................................................................................................................... 44 B.7.1. Implementation of the outsourcing policy ........................................................................ 44 B.7.2. Roles and responsibilities .................................................................................................. 48 B.7.3. Outsourcing of any critical or important operational functions ..................................... 49 B.8. Any other information ......................................................................................................... 49 C. Risk profile ................................................................................................................................... 50 C.1. Underwriting risk ................................................................................................................. 50 C.1.1. Description of the measures used ..................................................................................... 50 C.1.2. Description of the risk exposure ....................................................................................... 50 C.1.3. Description of assets investment ...................................................................................... 50 C.1.4. Risk concentration .............................................................................................................. 50 C.1.5. Risk mitigation ..................................................................................................................... 50 C.1.6. Expected profit included in future premiums ................................................................... 50 C.1.7. Risk sensitivity .................................................................................................................... 51 C.2. Market risk ............................................................................................................................ 51 C.2.1. Description of the measures used ..................................................................................... 51 C.2.2. Description of the risk exposure ....................................................................................... 51 C.2.3. Description of assets investment ...................................................................................... 52 C.2.4. Risk concentration .............................................................................................................. 54 C.2.5. Risk mitigation ..................................................................................................................... 55 C.2.6. Expected profit included in future premiums ................................................................... 55 C.2.7. Risk sensitivity .................................................................................................................... 55  Standard Financial Stress Scenarios ........................................................................ 56 C.2.7.1. Scenario analysis ........................................................................................................ 56 C.2.7.2.C.3. Credit risk ............................................................................................................................. 60 C.3.1. Description of the measures used ..................................................................................... 60 C.3.2. Description of the risk exposure ....................................................................................... 61 C.3.3. Description of assets investment ...................................................................................... 62 C.3.4. Risk concentration .............................................................................................................. 62  Monitoring of exposure at Group level ..................................................................... 62 C.3.4.1. Monitoring of reinsurance exposures at EH Ré SA level ........................................ 63 C.3.4.2.C.3.5. Risk mitigation ..................................................................................................................... 63 EH Ré SA Solvency and Financial Condition Report;page 5 of 98 C.3.6.;01.01.1970;1;1;85;100
71;10;;B.2.2. Description of processes and procedures in place;place The Fit & Proper checklist was reviewed and communicated to every Heads of Human resources. It can be found in annex of the Fit & Proper policy and defined more precisely the controls to be per-formed for all employee levels and in all situations. The human resources function strictly follows this guide to guarantee the reputation and professional expertise of each person coming within the scope of the Fit & Proper. Besides, the process of the Bank's regulatory reporting and pre-approval obligations is detailed in the policy application note to EH Ré SA. This process is carried out in coordination between human re-sources and the leg al department. At the same time, EH Group's Fit & Proper policy is applied to all legal entities within the scope of con-trol of EH Group. As a result, the CEOs of the subsidiaries and sub-subsidiaries of EH Group are sub-ject to Fit & Proper control. Thus the subsidiaries of EH Ré SA are also covered by this procedure. Processes for ensuring Fitness and Propriety at recruitment;01.01.1970;1;1;85;100
72;10;;B.2.1 B.2.1.1.;Senior Management is defined as the persons effectively running the undertaking i.e.: •;01.01.1970;1;1;85;100
73;9;;B.1.3. Material transactions;transactions There has not been any transaction with shareholders or members of the Administrative Management or Supervisory Board (AMSB) during the year 2016. B.2. Fit and proper requirements;01.01.1970;1;1;85;100
74;9;;B.1.2. Remuneration policy Definitions B.1.2.1. Senior Management;Management is defined as the members of the Board of Management Risk Takers;01.01.1970;1;1;85;100
75;9;;B.1.1 B.1.1.1.1 The Audit Committee ;The Board of Directors of EH Ré AG set up during one of its first meetings an Audit Committee which is common for reinsurance entities, EH Ré AG and EH Ré SA. Since both companies are fully integrated from an administrative perspective and as well on business perspective, they are automatically within the scope of the Audit Committee which has a global view on both entities. The Audit Committee is in charge of the following topics: •;01.01.1970;1;1;85;100
76;5;;A.3.3. Investments in securitization;securitization EH Ré SA invested in covered and mortgages securities. The following table summarizes the details of those investments.;01.01.1970;1;1;85;100
77;5;;A.3.2. Gains and losses recognized directly in equity;equity EH Ré SA does not recognize any gains and losses directly in equity. A.3.3. Investments in securitization;01.01.1970;1;1;85;100
78;4;;A.2.2. Underwriting performance by material geographical area;area The following table summarizes the underwriting performance split by material geographical areas. IFRS figures;01.01.1970;1;1;85;100
79;3;;A.1.4.;A.1.4. Significant events No significant event affected EH Ré SA during the year 2016. A.2. Underwriting Performance;01.01.1970;1;1;85;100
80;3;;A.1.3. Material lines of business and geographical areas;areas EH Ré AG and EH Ré SA are the EH Group reinsurance companies providing reinsurance solutions and capacity to all EH Group companies. Also, it covers the related non-consolidated companies in Austria, Portugal, Israël and Solunion, the Euler Hermes’ Joint Venture with Mapfre for the Spanish and Latin American countries. Since beginning of 2014 EH Ré SA has started to assume not only trade credit insurance from EH Group companies, but also bonding and fidelity business from EH Group companies as well as from Allianz companies and part of the Mapfre Bonding business. Mainly the business from the EH business units located in the European Union (EU) are ceding to EH Ré SA with the exception of the German and the French (only from underwriting year 2016 onwards) branch of Euler Hermes SA (EH SA) whereas the Asian Pacific branches of EH SA started to cede directly to EH Ré SA with underwriting year 2016. Lines of Business;01.01.1970;1;1;85;100
81;3;;A.1.2. Group structure and qualified holdings;holdings EH Ré SA is a fully owned subsidiary of Euler Hermes Ré AG (EH Ré AG), Switzerland, a 100% sub-sidiary of Euler Hermes Group (EH Group), the French holding company of the EH Group quoted at the French stock exchange. Below is a simplified group structure chart which also details the percent ownership and legal links to its parent entities and its material related undertakings.;01.01.1970;1;1;85;100
82;3;;A.1.1 A.1.1.2.;Commissariat aux Assurances (CAA) 7, boulevard Joseph II L - 1840 Luxembourg Auditor;01.01.1970;1;1;85;100
83;31;36.0;E.5 Niezgodność z minimalnym wymogiem kapitałowym i niezgodność z kapitałowym wymogiem wypłacalności;Solvency Capital Requirement E.5.1. Non-compliance with the Minimum Capital Requirement EH Ré SA is compliant with the Minimum Capital Requirement. E.5.2. Non-compliance with the Solvency Capital Requirement;01.01.1970;1;1;85;100
84;31;35.0;E.4 Różnice między formułą standardową a stosowanym modelem wewnętrznym;internal model used E.4.1. Description of the internal model;01.01.1970;1;1;85;100
85;31;34.0;E.3 Zastosowanie podmodułu ryzyka cen akcji opartego na duracji do obliczenia kapitałowego wymogu wypłacalności;Solvency Capital Requirement EH Ré SA does not use the duration-based equity risk sub-module in the calculation of its SCR as it is not applicable to its business. E.4.;01.01.1970;1;1;85;100
86;31;33.0;E.2 Kapitałowy wymóg wypłacalności i minimalny wymóg kapitałowy;Requirement .............................. 84 E.2.1. Amount of SCR and MCR ................................................................................................... 84 E.2.2. Standard formula ................................................................................................................. 85 E.2.3. Inputs to calculate the MCR ............................................................................................... 85 E.2.4. Material changes to SCR and MCR .................................................................................... 85 E.3. Use of the duration-based equity risk sub-module in the calculation of the Solvency Capital Requirement ........................................................................................................................ 85 E.4. Differences between the standard formula and any internal model used ..................... 85 E.4.1. Description of the internal model ...................................................................................... 85 E.4.2. Methodologies ..................................................................................................................... 87 Process within the internal model ............................................................................. 87 E.4.2.1.E.4.2.1.1 Market Risk ................................................................................................................... 87 E.4.2.1.2 Reserve risk ................................................................................................................. 87 E.4.2.1.3 Credit risk ..................................................................................................................... 88 E.4.2.1.3.1 Credit risk for reinsurance and investment modelling ........................................ 88 E.4.2.1.3.2 Credit risk for trade credit insurance & surety ..................................................... 88 E.4.2.1.4 Aggregation and diversification ................................................................................. 89 Difference between standard model and internal model ........................................ 90 E.4.2.2.E.4.2.2.1 Market risk .................................................................................................................... 90 E.4.2.2.2 Credit risk ..................................................................................................................... 90 E.4.2.2.3 Non-Life Risks: ............................................................................................................ 91 E.4.2.2.4 Business Risks ............................................................................................................ 91 E.4.2.2.5 Operational risk ........................................................................................................... 92 Diversification .............................................................................................................. 92 E.4.2.3.E.4.2.3.1 Tax relief ....................................................................................................................... 92 E.4.3. Data quality .......................................................................................................................... 92 E.4.4. Risks not covered by standard formula but covered by internal model ....................... 93 E.5. Non-compliance with the Minimum Capital Requirement and non-compliance with the Solvency Capital Requirement ....................................................................................................... 93 E.5.1. Non-compliance with the Minimum Capital Requirement ............................................... 93 E.5.2. Non-compliance with the Solvency Capital Requirement ............................................... 93 E.6. Any other information ......................................................................................................... 93 Appendix 1: Key terms and abbreviations........................................................................................ 94 Appendix 2: Publically disclosed QRTs ............................................................................................ 97 Appendix 3: Disclaimer ....................................................................................................................... 98;01.01.1970;1;1;85;100
87;31;32.0;E.1 Środki własne;funds E.1.1. Information on the own funds Management of the own funds E.1.1.1. Capital poses the central resource for EH Ré SA to support the multiple activities. It ties to EH RÉ SA risk strategy which defines the relevant risk appetite with regard to the risk bearing capacity including EH RÉ SA’s capital and solvency targets as well as risk limits, thus implementing the EH RÉ SA’s business strategy. Capital management describes the set of activities undertaken by EH RÉ SA to ensure its adequate capitalization. The following principles are applied: 1.;01.01.1970;1;1;85;100
88;25;30.0;D.5 Wszelkie inne informacje;information There is no other information to disclose with regards to valuation for solvency purposes. MVBS asset;01.01.1970;1;1;85;100
89;25;29.0;D.4 Alternatywne metody wyceny;for valuation For every class of assets, alternative valuation method is used if the asset class price is not quoted on an active market for the same assets. The following table summarizes the asset classes that are valu-ated using alternative valuation methods.;01.01.1970;1;1;85;100
90;25;28.0;D.3 Inne zobowiązania;liabilities The following table summarizes the amounts for EH Ré SA other liabilities, classified by other liabilities classes as disclosed in the QRT, for both MVBS valuation and LUXGAAP valuation. Deposits from reinsurers;01.01.1970;1;1;85;100
91;25;27.0;D.2 Rezerwy techniczno-ubezpieczeniowe;provisions D.2.1. Valuation of technical provisions for solvency purposes The table below summarizes the technical provisions amounts by SII LoB. In €;01.01.1970;1;1;85;100
92;25;26.0;D.1 Aktywa;Assets D.1.1. Valuation of assets The following table summarizes the amounts for EH Ré SA assets, classified by asset classes as dis-closed in the Quantitative Reporting Templates (QRT), for both MVBS valuation and LUXGAAP valua-tion.;01.01.1970;1;1;85;100
93;17;22.0;C.5 Ryzyko operacyjne;risk C.5.1. Description of the measures used;01.01.1970;1;1;85;100
94;17;21.0;C.4 Ryzyko płynności;risk C.4.1. Description of the measures used;01.01.1970;1;1;85;100
95;17;20.0;C.3 Ryzyko kredytowe;risk C.3.1. Description of the measures used EH Ré SA’s Risk Management team measures and assesses its risks using EH Ré SA’s internal risk capital model. Further details on the methodologies used within the internal model for credit risk can be found in Section E.4.2.1. EH Ré SA Solvency and Financial Condition Report;01.01.1970;1;1;85;100
96;17;19.0;C.2 Ryzyko rynkowe;risk C.2.1. Description of the measures used;01.01.1970;1;1;85;100
97;17;18.0;C.1 Ryzyko aktuarialne;risk C.1.1. Description of the measures used EH Ré SA’s Risk Management team measures and assesses its risks using EH Ré SA’s internal risk capital model. Further details on the methodologies used within the internal model for underwriting risk can be found in Section E.4.2.1. The internal model reflects the risk profile of EH Ré SA and is used to measure the solvability through the risk capital. The model has to be used in both strategic and tactical decisions to ensure that a suf-ficient risk tolerance is respected. Following that, Internal Model should be appropriate for all the dif-ferent decisions that can be taken in the company and that have an impact on the risk profile and be appropriate for the use.;01.01.1970;1;1;85;100
98;8;15.0;B.7  Outsourcing of a Key Function B.2.2.3.;In cases where a Key Function is outsourced according to the EH Ré SA Outsourcing Policy, the due diligence of the Provider by the Business Owner comprises a description of the process used by the Provider to ensure the Fitness and Propriety of its personal and a written confirmation that the Provid-er’s personal working within the outsourced Key Function is Fit and Proper (Fit and Proper Test). At the date of the writing of the narrative report, no key function is outsourced. Assessment results;01.01.1970;1;1;85;100
99;8;13.0;B.5 Funkcja audytu wewnętrznego;function B.5.1. Internal audit function implementation within EH Ré SA EH Ré SA does not have its own internal audit function. This is outsourced to EH Group. This function is performed independently so that it reports to the Chief Executive Officer (CEO) and to the Audit and Risk Committee. Audit is organized by function: •;01.01.1970;1;1;85;100
100;8;12.0;B.4 System kontroli wewnętrznej;system B.4.1. Description of internal control system Internal control framework The internal control framework is laid out in EH Ré SA’s Governance and Controls Policy, as approved by the Management Committee. The EH Ré SA internal control system has the following objectives: •;01.01.1970;1;1;85;100
