;ID_SEKCJA NADRZĘDNA;ID_SEKCJA;NAZWA_SEKCJI;TREŚĆ;DATA SFCR;WERSJA SFCR;KOD ZAKŁADU;KOD ZAKLADU;ID_TAB
0;36;;E.5.2. Non-compliance with the Solvency Capital Requirement;Requirement EH Ré SA is compliant with the Solvency Capital Requirement. E.6.;01.01.1970;1;1;85;100
1;35;;E.4.4. Risks not covered by standard formula but covered by internal model;model The only risk that is not covered by the standard formula but that is covered by the internal model is the business risk. It is composed of both Lapse risk and Cost risk as defined below. •;01.01.1970;1;1;85;100
2;35;;E.4.3. Data quality;"quality EH Ré SA has implemented a data quality framework across the whole company in accordance with the Solvency II expectations. Thus, EH Ré SA has produced all necessary deliverables with roles and responsibilities for each of them adding to an overall data governance organization. Hence, the EH Ré SA data quality framework has set in place specific committees at different levels (the Group Data Quality Council at strategic level and the Data Committee at operational level) and a clear definition of the stakeholders’ roles and responsibilities with validated attributions. Moreover, in order to monitor the quality of data, KPIs have been implemented, are monitored and reported to the various committees through data quality dashboards. This consolidation and reporting towards data committees are executed in such a way to be aligned to the EH quarterly risk capital closing process. These KPIs are reported separately: KPIs per risk type on one side and IT KPIs on the other side. Hereunder is a Data Quality Dashboard (DQD) as of Q4 2016 showing that the quality of the data used at EH Ré (both AG and SA) to calculate the RC is totally under control ; no KPIs at EH Ré level are assessed as not effective yet (KO). EH Ré SA Solvency and Financial Condition Report";01.01.1970;1;1;85;100
3;35;;E.4.2. Methodologies Process within the internal model E.4.2.1.;E.4.2.1. EH Ré SA uses a full internal model to calculate its risk capital. The main methodologies and assump-tions used in its internal model are detailed in the following sections. E.4.2.1.1 Market Risk;01.01.1970;1;1;85;100
4;35;;E.4.1. Description of the internal model;model Purposes for using an internal model;01.01.1970;1;1;85;100
5;33;;E.2.4. Material changes to SCR and MCR;MCR No material change affected both EH Ré SA’s SCR and MCR.;01.01.1970;1;1;85;100
6;33;;E.2.3. Inputs to calculate the MCR;MCR The Minimum Capital Ratio for EH Ré SA based on internal and standard model is shown below for Q4 2016. For the standard model as well as for the internal model, the MCR equals the floor of 25% of the SCR. The calculation approach, which is the one recommended by the EIOPA, is exactly the same as in previous quarters and is explained below the table. The main inputs that enter into the calculation of EH Ré SA’s MCR are summarized in the table below Main inputs for MCR calculation;01.01.1970;1;1;85;100
7;33;;E.2.2. Standard formula;formula EH RÉ SA does not use the standard formula and has instead developed its own internal model. E.2.3. Inputs to calculate the MCR;01.01.1970;1;1;85;100
8;32;;E.1.3. Reconciliation reserve;reserve The following table summarizes the calculation of reconciliation reserve. Breakdown of the reconciliation reserve (MVBS) In M€;01.01.1970;1;1;85;100
9;32;;E.1.2. Additional ratios;ratios EH Ré SA does not disclose any other additional ratios. E.1.3. Reconciliation reserve;01.01.1970;1;1;85;100
10;32;;E.1.1 E.1.1.2.;Under Solvency II, Own Funds are distinguished into Basic Own Funds and Ancillary Own Funds. Basic Own Funds are defined as the excess of assets over liabilities plus any qualifying subordinated liabilities. Ancillary Own Funds are defined as any capital resources other than Basic Own Funds that could be called up in order to absorb losses. Ancillary Own Funds are off-balance sheet and require regulatory approval in order to qualify. EH Ré SA Solvency and Financial Condition Report;01.01.1970;1;1;85;100
11;28;;D.3.5. Contingent liabilities;liabilities EH Ré SA does not recognize any contingent liability. D.4. Alternative methods for valuation;01.01.1970;1;1;85;100
12;28;;D.3.4. Employee benefits;benefits EH Ré SA does not have any employees. D.3.5. Contingent liabilities;01.01.1970;1;1;85;100
13;28;;D.3.3. Economic benefits;benefits EH Ré SA does not recognize any outflows of economic benefits. D.3.4. Employee benefits;01.01.1970;1;1;85;100
14;28;;D.3.2. Deferred tax liabilities;liabilities On 31 December 2016, the total deferred tax liabilities equalled 32.2M€ (Solvency II value). Deferred tax liabilities are mainly due to temporary differences due to the claims equalization reserve. EH Ré SA Solvency and Financial Condition Report;01.01.1970;1;1;85;100
15;28;;D.3.1. Leasing arrangements;arrangements EH Ré SA does not have any financial or operating leases. D.3.2. Deferred tax liabilities;01.01.1970;1;1;85;100
16;27;;D.2.9. Recoverable from mitigation techniques;techniques In 2016, EH Ré SA had reinsurance recoverables of nearly 489M€. The recoverables are coming from non-life excluding health. Of these recoverables, 90.9% come from claims provisions, with the re-maining due to premium provisions. There were no recoverables from special purpose vehicles. D.3. Other liabilities;01.01.1970;1;1;85;100
17;27;;D.2.8. Transitional deduction;deduction EH Ré SA does not apply the transitional deduction referred to in Article 308d of Directive 2009/138/EC. D.2.9. Recoverable from mitigation techniques;01.01.1970;1;1;85;100
18;27;;D.2.7. Transitional risk-free interest rate-term structure;structure EH Ré SA does not apply the transitional risk-free interest rate-term structure referred to in Article 308c of Directive 2009/138/EC. D.2.8. Transitional deduction;01.01.1970;1;1;85;100
19;27;;D.2.6.;D.2.6. Volatility adjustment The discount effect is currently calculated by taking into account the volatility adjustment (VA) inside the risk-free SWAP (yield) curves. A sensitivity study have been performed where only the EUR SWAP curve with and without volatility adjustment is applied to the cashflows, i.e. omitting the impact of different settlement currencies. In k€;01.01.1970;1;1;85;100
20;27;;D.2.5. Matching adjustment;adjustment EH Ré SA does not apply a matching adjustment. D.2.6.;01.01.1970;1;1;85;100
21;27;;D.2.4. Differences with technical provisions in financial statements;statements In MVBS, technical provisions amount as of Q4 2016 was at 545M€. In LUXGAAP the amount was at 690M€. This difference is explained by the three following reasons: •;01.01.1970;1;1;85;100
22;27;;D.2.3. Material changes in calculation assumptions for technical provisions;provisions As EH Ré SA mainly reinsures business from EH SA, the four following material changes in the rele-vant assumptions in the calculation of technical provisions that have been required by the National Bank of Belgium (NBB) to EH SA are also applicable to EH Ré SA: •;01.01.1970;1;1;85;100
23;27;;D.2.2. Level of uncertainty;uncertainty In this section we are showing both, the uncertainty of undiscounted claims reserves estimations (i.e. stochastic reserve analysis) as well as the sensitivity of Technical Provisions (TP) on certain input parameters. Stochastic Reserving;01.01.1970;1;1;85;100
24;26;;D.1.9. Aggregating class of assets;assets Asset classes are in line with QRT requirements. D.2. Technical provisions;01.01.1970;1;1;85;100
25;26;;D.1.8. Material deferred tax assets;assets EH Ré SA does not have any material deferred tax assets. D.1.9. Aggregating class of assets;01.01.1970;1;1;85;100
26;26;;D.1.7. Financial and operating leases;leases EH Ré SA does not have any financial or operating leases. D.1.8. Material deferred tax assets;01.01.1970;1;1;85;100
27;26;;D.1.6. Related undertakings not valued using quoted market prices or the adjusted equity method;method EH Ré SA does not have any related undertakings. D.1.7. Financial and operating leases;01.01.1970;1;1;85;100
28;26;;D.1.5. Material financial assets;assets D.1.6. Related undertakings not valued using quoted market prices or the adjusted equity;01.01.1970;1;1;85;100
29;26;;D.1.4. Assumptions and judgments on the future and other major sources of estimation uncertainty;uncertainty There are no specific assumptions or judgments about future and other major sources of estimation uncertainty. D.1.5. Material financial assets;01.01.1970;1;1;85;100
30;26;;D.1.3. Changes to the recognition and valuation bases used or to estimations;estimations;01.01.1970;1;1;85;100
31;26;;D.1.2. Material intangible assets;assets EH Ré SA does not have any material intangible asset.;01.01.1970;1;1;85;100
32;22;;C.5.7. Risk sensitivity;sensitivity Please refer to section C.2.7 of this report for information on relevant stress tests and scenario analy-sis, as well as the underlying methods and main assumptions. C.6. Other material risks;01.01.1970;1;1;85;100
33;22;;C.5.6. Expected profit included in future premiums;premiums Please refer to Section C.2.6 of this report for information on the total amount of the expected profit included in future premiums. C.5.7. Risk sensitivity;01.01.1970;1;1;85;100
34;22;;C.5.5. Risk mitigation;mitigation EH Ré SA does not enter into specific risk mitigation techniques for operational risk.;01.01.1970;1;1;85;100
35;22;;C.5.4. Risk concentration;concentration EH Ré SA is not exposed to any material risk concentration regarding operational risk. C.5.5. Risk mitigation;01.01.1970;1;1;85;100
36;22;;C.5.3. Description of assets investment;investment Please refer to Section C.2.3 of this report for information regarding how assets have been invested in accordance with the “prudent person principle” so that EH Ré SA’s risks have been properly managed. C.5.4. Risk concentration;01.01.1970;1;1;85;100
37;22;;C.5.2. Description of the risk exposure;exposure Below is EH Ré SA’s definition of operational risk, as well as several sub-categories of this risk: •;01.01.1970;1;1;85;100
38;22;;C.5.1. Description of the measures used;used EH Ré SA has an own internal model to compute the loss distribution attached to the operational risk. The computation is based mainly on four elements: •;01.01.1970;1;1;85;100
39;21;;C.4.7. Risk sensitivity;sensitivity EH Ré SA identified several liquidity stress scenarios and chose to perform the one which appeared to be the most relevant for 2016: a deterioration of the market conditions leading to an economic crisis, a recession event which implies an increase of the claim frequency for credit insurers. Thus, a combination of a market stress scenario and a recession scenario (reserve risk and credit risk) was simulated. The following graph shows the stress scenario liquidity analysis: Market values of the assets classified by their convertibility into cash;01.01.1970;1;1;85;100
40;21;;C.4.6. Expected profit included in future premiums;premiums Please refer to Section C.2.6 of this report for information on the total amount of the expected profit included in future premiums. C.4.7. Risk sensitivity;01.01.1970;1;1;85;100
41;21;;C.4.5. Risk mitigation;mitigation EH Ré SA liquidity risk is borne by EH Ré AG. EH Ré SA would face any liquidity issue by increasing its capital.;01.01.1970;1;1;85;100
42;21;;C.4.4. Risk concentration;concentration EH Ré SA is not exposed to any material risk concentration regarding liquidity risk. C.4.5. Risk mitigation;01.01.1970;1;1;85;100
43;21;;C.4.3. Description of assets investment;investment Please refer to Section C.2.3 of this report for information regarding how assets have been invested in accordance with the “prudent person principle” so that EH Ré SA’s risks have been properly managed. C.4.4. Risk concentration;01.01.1970;1;1;85;100
44;21;;C.4.2. Description of the risk exposure;exposure The following table shows that, as of Q4 2016, more than 90% of EH Ré SA’s assets are liquid or highly liquid. EH Ré SA Solvency and Financial Condition Report;01.01.1970;1;1;85;100
45;21;;C.4.1. Description of the measures used;used The liquidity risk is the risk that requirements from current or future payment obligations cannot be met. This comprises insufficient liquidity resources to meet payment obligations under current (base case scenario) as well as potential future conditions (stress scenarios). Liquidity risk management is a component of EH Ré SA’s risk appetite and is a core part of the finan-cial planning, taking into account the cash flow schedule as well as capital allocation process. In accordance with the Liquidity Risk Management policy currently being implemented, an analysis has been performed to identify accurately the resources and needs of liquidity and to simulate the evolution of EH Ré SA’s liquidity ratio on different time horizons and in different conditions. In this approach, we consider the liquidity ratio as being the fraction of needs of liquidity over re-sources of liquidity: •;01.01.1970;1;1;85;100
46;20;;C.3.7. Risk sensitivity;sensitivity Please refer to section C.2.7 of this report for information on relevant stress tests and scenario analy-sis, as well as the underlying methods and main assumptions. EH Ré SA Solvency and Financial Condition Report;01.01.1970;1;1;85;100
47;20;;C.3.6. Expected profit included in future premiums ................................................................... 64 C.3.7. Risk sensitivity .................................................................................................................... 64 C.4. Liquidity risk ........................................................................................................................ 65 C.4.1. Description of the measures used ..................................................................................... 65 C.4.2. Description of the risk exposure ....................................................................................... 65 C.4.3. Description of assets investment ...................................................................................... 66 C.4.4. Risk concentration .............................................................................................................. 66 C.4.5. Risk mitigation ..................................................................................................................... 66 C.4.6. Expected profit included in future premiums ................................................................... 66 C.4.7. Risk sensitivity .................................................................................................................... 66 C.5. Operational risk ................................................................................................................... 67 C.5.1. Description of the measures used ..................................................................................... 67 C.5.2. Description of the risk exposure ....................................................................................... 68 C.5.3. Description of assets investment ...................................................................................... 69 C.5.4. Risk concentration .............................................................................................................. 69 C.5.5. Risk mitigation ..................................................................................................................... 69 C.5.6. Expected profit included in future premiums ................................................................... 69 C.5.7. Risk sensitivity .................................................................................................................... 69 C.6. Other material risks ............................................................................................................. 69 C.7. Any other information ......................................................................................................... 69 D. Valuation for solvency purposes ............................................................................................... 70 D.1. Assets ................................................................................................................................... 70 D.1.1. Valuation of assets .............................................................................................................. 70 D.1.2. Material intangible assets ................................................................................................... 73 D.1.3. Changes to the recognition and valuation bases used or to estimations ..................... 73 D.1.4. Assumptions and judgments on the future and other major sources of estimation uncertainty ....................................................................................................................................... 73 D.1.5. Material financial assets ..................................................................................................... 73 D.1.6. Related undertakings not valued using quoted market prices or the adjusted equity method .............................................................................................................................................. 73 D.1.7. Financial and operating leases .......................................................................................... 73 D.1.8. Material deferred tax assets ............................................................................................... 73 D.1.9. Aggregating class of assets ............................................................................................... 73 D.2. Technical provisions ........................................................................................................... 73 D.2.1. Valuation of technical provisions for solvency purposes .............................................. 73 D.2.2. Level of uncertainty ............................................................................................................. 76 D.2.3. Material changes in calculation assumptions for technical provisions ........................ 77 D.2.4. Differences with technical provisions in financial statements ....................................... 77 D.2.5. Matching adjustment ........................................................................................................... 77 D.2.6. Volatility adjustment ........................................................................................................... 77 D.2.7. Transitional risk-free interest rate-term structure ........................................................... 78 D.2.8. Transitional deduction ........................................................................................................ 78 D.2.9. Recoverable from mitigation techniques .......................................................................... 78 D.3. Other liabilities ..................................................................................................................... 78 D.3.1. Leasing arrangements ........................................................................................................ 80 D.3.2. Deferred tax liabilities ......................................................................................................... 80 D.3.3. Economic benefits ............................................................................................................... 81 D.3.4. Employee benefits ............................................................................................................... 81 D.3.5. Contingent liabilities ........................................................................................................... 81 D.4. Alternative methods for valuation ..................................................................................... 81 D.5. Any other information ......................................................................................................... 81 E. Capital Management .................................................................................................................... 82 E.1. Own funds ............................................................................................................................ 82 E.1.1. Information on the own funds ............................................................................................ 82 Management of the own funds ................................................................................... 82 E.1.1.1. Description of the own funds ..................................................................................... 82 E.1.1.2. SCR and MCR covers .................................................................................................. 83 E.1.1.3. Differences between valuation in financial statements and for solvency purposesE.1.1.4. 84 Description of items deducted from own funds ....................................................... 84 E.1.1.5.E.1.2. Additional ratios .................................................................................................................. 84 E.1.3. Reconciliation reserve ........................................................................................................ 84 EH Ré SA Solvency and Financial Condition Report;Report page 6 of 98 E.2.;01.01.1970;1;1;85;100
48;20;;C.3.5. Risk mitigation;mitigation Regarding risk mitigation, below is an overview of EH Ré SA’s reinsurance structure in 2016:;01.01.1970;1;1;85;100
49;20;;C.3.4. Risk concentration;concentration For EH Ré SA, two kinds of monitoring have to be considered: •;01.01.1970;1;1;85;100
50;20;;C.3.3. Description of assets investment;investment Please refer to Section C.2.3 of this report for information regarding how assets have been invested in accordance with the “prudent person principle” so that EH Ré SA’s risks have been properly managed. C.3.4. Risk concentration;01.01.1970;1;1;85;100
51;20;;C.3.2. Description of the risk exposure;exposure Within EH Ré SA, Credit Risk is composed of the following risks: •;01.01.1970;1;1;85;100
52;19;;C.2.7. Risk sensitivity;sensitivity EH Ré SA has designed and implemented a firm-wide program covering stress testing, reverse stress testing and scenario analysis. For stress tests, EH Ré SA usually follows standards shocks in line with European Insurance and Oc-cupational Pensions Authority (EIOPA) recommendations. For scenario analysis and reverse stress tests, a dedicated process is run by the Enterprise Stress Testing Group which is a panel made of risk, business and economic experts who meet on an annual basis to identify up to 5 most relevant stress scenarios for the year to come. These scenarios are subsequently proposed to EH Risk Committee for review and selection before execution across the company. EH Ré SA Solvency and Financial Condition Report;01.01.1970;1;1;85;100
53;19;;C.2.6. Expected profit included in future premiums;premiums EH Ré SA’s expected profits included in future premiums (EPIFP) amount to 4.3 M€. C.2.7. Risk sensitivity;01.01.1970;1;1;85;100
54;19;;C.2.5. Risk mitigation;mitigation The following tables summarize the level of the sensitivity limits in place. Some of these limits are monitored at Group level. Financial limits applied at EH Group level;01.01.1970;1;1;85;100
55;19;;C.2.4. Risk concentration;concentration On the basis of the requirement that insurance technical liabilities are to be covered or secured at all times with investment portfolios showing low volatility, the diversification of risk within the portfolios is of special importance. Diversification is a central part of the Investment Policy and is to be pursued: •;01.01.1970;1;1;85;100
56;19;;C.2.3. Description of assets investment;investment EH Ré SA actively manages its investment portfolio and is actively taking investment risks in a con-trolled and limited manner. This is based on the firm belief that by taking risks on the investment side additional value can be generated on a mid to long-term basis, i.e. that the additional return on in-vestments overcompensates the additional cost of capital in the mid- to long-run. This approach results in a mid to long-term focused investment policy with an emphasis on strategic asset allocation and the goal of realizing the long-term risk premium of asset classes. Tactical asset allocation is used on a limited basis as an enhancement to the strategic asset allocation in order to profit from market opportunities. The investment activities follow the general principles of a congruent Asset Liability Management (ALM) with a sufficient duration and currency matching within prescribed limits. All technical reserves shall be supported by investments made by Investment and Treasury Group (ITG) in respect with local regulation. EH Ré SA’s investment strategy aims for a positive global mid- to long-term (3-5 years) risk adjusted after tax investment return considering: •;01.01.1970;1;1;85;100
57;19;;C.2.2. Description of the risk exposure;exposure Within EH Ré SA, Market Risk is composed of the following risks: •;01.01.1970;1;1;85;100
58;19;;C.2.1. Description of the measures used;used EH Ré SA’s Risk Management team measures and assesses its risks using EH Ré SA’s internal risk capital model. Further details on the methodologies used within the internal model for market risk can be found in Section E.4.2.1. The table below summarizes model changes which had an impact on market risk assessment. Model Change;01.01.1970;1;1;85;100
59;18;;C.1.7. Risk sensitivity;sensitivity Information on relevant stress tests and scenario analysis, as well as the underlying methods and main assumptions, can be found in Section C.2.7 of this report. C.2. Market risk;01.01.1970;1;1;85;100
