;ID_SEKCJA NADRZĘDNA;ID_SEKCJA;NAZWA_SEKCJI;TREŚĆ;DATA SFCR;WERSJA SFCR;KOD ZAKŁADU;KOD ZAKLADU;ID_TAB
38;8;13.0;B.5 Funkcja audytu wewnętrznego;WEWNĘTRZNEGO Funkcja audytu wewnętrznego została wdrożona w Pramerica zgodnie z wewnętrzną Polityką kluczowych funkcji przyjętą Uchwałą Zarządu. Umiejscowienie funkcji audytu wewnętrznego w strukturze organizacyjnej Spółki zapewnia jej niezależność operacyjną i oddzielenie od funkcji związanych z osiągnięciem celów biznesowych. Funkcja audytu wewnętrznego pełniona jest przez Audytora Wewnętrznego podlegającego bezpośrednio Prezesowi Zarządu Pramerica. Nadzór nad Audytorem Wewnętrznym sprawuje Komitet Audytu. Zasady funkcjonowania audytu wewnętrznego w Spółce oraz zasady realizacji zadań osoby nadzorującej funkcję audytu wewnętrznego zostały opisane w przyjętych przez Zarząd i Radę Nadzorczą przepisach wewnętrznych. Funkcja audytu ma zapewnione odpowiednie uprawnienia i zasoby niezbędne do efektywnego wykonywania zadań. W szczególności Audytor Wewnętrzny posiada odpowiednie kwalifikacje i doświadczenie umożliwiające mu właściwe wykonywanie powierzonych obowiązków oraz ma zapewniony dostęp do informacji niezbędnych do wykonywania swoich zadań. Niezależność funkcji audytu wewnętrznego jest zapewniona poprzez odpowiednie usytuowanie organizacyjne oraz zakres zadań Audytora Wewnętrznego, które sprowadzają się wyłącznie do przeprowadzania niezależnych audytów. Audytor Wewnętrzny pozostaje niezależny od czynności stanowiących przedmiot audytu i nie posiada związanych z nimi uprawnień ani zadań operacyjnych. Audytor Wewnętrzny ma zapewniony dostęp do członków Komitetu Audytu oraz Prezesa Zarządu i Członków Zarządu Spółki. W szczególności, Audytor Wewnętrzny może uczestniczyć w posiedzeniach Zarządu Spółki i Rady Nadzorczej. Audytor Wewnętrzny jest uprawniony do uzyskania pełnego, swobodnego i nieograniczonego dostępu do wszystkich procesów, zbiorów ewidencji informacji, dokumentacji, składników majątku, pomieszczeń i pracowników jednostek podlegających audytowi. Osoby odpowiedzialne za czynności będące przedmiotem audytu mają obowiązek służyć pomocą w celu zapewnienia sprawnego przebiegu audytu.;31.12.2017;1;1;59;152
39;8;12.0;B.4 System kontroli wewnętrznej;WEWNĘTRZNEJ System kontroli wewnętrznej Pramerica jest dostosowany do struktury organizacyjnej, złożoności prowadzonej działalności, skali oraz profilu ryzyka Spółki. System kontroli wewnętrznej obejmuje wszystkie regulacje, procedury i struktury organizacyjne, które działając razem zmierzają do zapewnienia: ;31.12.2017;1;1;59;152
40;8;11.0;B.3 System zarządzania ryzykiem, w tym własna ocena ryzyka i wypłacalności;WYPŁACALNOŚCI Pramerica realizuje swoje cele biznesowe w sposób bezpieczny i adekwatny do skali ponoszonego ryzyka. Celem zarządzania ryzykiem jest identyfikacja potencjalnych zdarzeń, które mogą wpłynąć na Pramerica i realizację jej celów oraz utrzymanie ryzyka w ustalonych granicach. Nadrzędnym dokumentem regulującym system zarządzania ryzykiem w Pramerica jest Polityka Zarządzania Ryzykiem, która wyznacza główne elementy wszechstronnego podejścia do ryzyka związanego z prowadzoną przez Spółkę działalnością i wynikającego z przyjętej strategii biznesowej. Definiuje zidentyfikowane przez Spółkę rodzaje ryzyka, wskazuje cele oraz towarzyszące im zasady zarządzania ryzykiem, docelową strukturę ryzyka związanego z prowadzoną działalnością oraz akceptowany poziom ryzyka. Polityka Zarządzania Ryzykiem jest integralną częścią procesu zarządzania w Pramerica. Skuteczność systemu zarządzania ryzykiem przejawia się w Pramerica poprzez: ;31.12.2017;1;1;59;152
41;8;10.0;B.2 Wymogi dotyczące kompetencji i reputacji;REPUTACJI Pramerica, działając zgodnie z obowiązującymi regulacjami prawnymi, wprowadziła zasady dotyczące kompetencji i reputacji dla kluczowych funkcji w Spółce. Jako kluczowe Pramerica identyfikuje funkcje Członków Rady Nadzorczej, Członków Zarządu oraz osoby nadzorujące inne kluczowe funkcje, w tym: ;31.12.2017;1;1;59;152
42;8;9.0;B.1 Informacje ogólne o systemie zarządzania;ZARZĄDZANIA Ogólne zasady systemu zarządzania w Pramerica, tj. systemu regulacji i procedur określających wytyczne do działania organów Spółki, wynikają z regulacji ustawowych, w szczególności z Kodeksu spółek handlowych i ustawy z dnia 11 września 2015 r. o działalności ubezpieczeniowej i reasekuracyjnej, przepisów regulujących funkcjonowanie rynku ubezpieczeniowego, standardów wewnętrznych, jak również przyjętych standardów obowiązujących w grupie PFI. Ponadto zasady kształtowania relacji z interesariuszami ustala własny Kodeks Postępowania Pramerica odzwierciedlający wartości, którymi kieruje się Spółka i przedstawiający oczekiwania pożądanych zachowań. Jest on także podstawą zasad wewnętrznych Pramerica. Pramerica uznaje, że system zarządzania jest obecnie adekwatny i uwzględnia skalę i złożoność działalności Spółki. System zarządzania pozwala na efektywne zarządzanie ryzykiem, zgodnie z obecnym profilem ryzyka Spółki. Przyjęta struktura organizacyjna wspiera cele strategiczne i działania Spółki oraz zapewnia, że Zarząd może podejmować świadomie decyzje biznesowe z pełnym uwzględnieniem wpływu na ekspozycje związane z ryzykiem. Pramerica poddaje system zarządzania regularnemu przeglądowi w ramach jego ciągłego doskonalenia. W okresie sprawozdawczym Spółka oprócz zmian w składzie Zarządu i Rady Nadzorczej nie dokonała istotnych zmian systemu zarządzania. Władzami Pramerica są: Walne Zgromadzenie Akcjonariuszy, Rada Nadzorcza oraz Zarząd. Strukturę organizacyjną władz Pramerica oraz zakres ich działania określa Statut Pramerica oraz regulaminy Rady Nadzorczej i Zarządu. Do reprezentowania i prowadzenia spraw Spółki upoważniony jest Zarząd, zgodnie z zasadami reprezentacji określonymi w Statucie Pramerica. Schemat akceptacyjny związany z przygotowaniem dokumentacji niezbędnej do podjęcia decyzji przez Zarząd Spółki określają matryce decyzyjne Pramerica, przyjmowane w drodze uchwały Zarządu. Zarząd może udzielać pełnomocnictw pracownikom do działania w imieniu Pramerica. B.1.1. RADA NADZORCZA;31.12.2017;1;1;59;152
43;2;7.0;A.5 Wszelkie inne informacje;INFORMACJE Wszelkie istotne informacje dotyczące działalności i wyników operacyjnych Spółki zostały zawarte w rozdziałach A.1-A.4.;31.12.2017;1;1;59;152
44;2;6.0;A.4 Wyniki z pozostałych rodzajów działalności;DZIAŁALNOŚCI W 2017 r. Spółka nie rozpoznała istotnych przychodów i kosztów innych, niż przychody i koszty z działalności operacyjnej lub lokacyjnej. Ponadto Spółka nie była stroną jakichkolwiek umów leasingowych, które wymagałyby ujawnienia w sprawozdaniu. A.5. WSZELKIE INNE INFORMACJE;31.12.2017;1;1;59;152
45;2;5.0;A.3 Wynik z działalności lokacyjnej;LOKACYJNEJ (INWESTYCYJNEJ) Łączny wynik z działalności lokacyjnej Pramerica, wyznaczony jako nadwyżka przychodów z lokat nad kosztami działalności lokacyjnej w 2017 r. wyniósł 28,2 mln PLN – o 13% więcej niż w poprzednim okresie sprawozdawczym. W Tabeli 3 przedstawiono porównanie przychodów z działalności inwestycyjnej osiągniętych przez Pramerica w bieżącym oraz w poprzednim okresie sprawozdawczym w podziale na klasy aktywów. Aktywa;31.12.2017;1;1;59;152
46;2;4.0;A.2 Wynik z działalności ubezpieczeniowej;UBEZPIECZENIOWEJ Pramerica w 2017 r. odnotowała zysk netto w wysokości 27,4 mln PLN. Wynik ten jest o 38% wyższy od ubiegłorocznego. Przypis składki brutto Spółki również wzrósł i wyniósł 261,8 mln PLN. W Tabeli 1 przedstawiono przychody i koszty działalności operacyjnej dla bieżącego oraz poprzedniego okresu sprawozdawczego. Wyniki zostały opracowane w oparciu o polskie standardy rachunkowości. Linia biznesowa;31.12.2017;1;1;59;152
47;2;3.0;A.1 Działalność;DZIAŁALNOŚĆ Pramerica Życie TUiR S.A. posiada siedzibę w Warszawie, przy Al. Jana Pawła II 17, 00-854 Warszawa. Spółka jest wpisana do rejestru przedsiębiorców w Sądzie Rejonowym dla m.st. Warszawy XII Wydział Gospodarczy Krajowego Rejestru Sądowego KRS: 0000008906, NIP: 526-22-62-838, REGON: 013281575. Organem odpowiedzialnym za nadzór finansowy nad Spółką jest Komisja Nadzoru Finansowego. Dane kontaktowe: Komisja Nadzoru Finansowego Plac Powstańców Warszawy 1 00-030 Warszawa;31.12.2017;1;1;59;152
