;ID_SEKCJA NADRZĘDNA;ID_SEKCJA;NAZWA_SEKCJI;TREŚĆ;DATA SFCR;WERSJA SFCR;KOD ZAKŁADU;KOD ZAKLADU;ID_TAB
0;;;B3 System zarządzania ryzykiem, w tym wła-sna ocena ryzyka i wypłacalności B.3.1 Funkcja zarządzania ryzykiem;ryzykiemNa dzień 31 grudnia 2018 roku nadzór nad funkcją zarządzania ry-zykiem Towarzystwo powierzyło Menedżerowi ds. Zarządzania Ry-zykiem, raportującemu do Członka Zarządu ds. ryzyka oraz do Ko-mitetu Audytu i Ryzyka. Ponadto od dnia 9 stycznia 2018 roku Pani Elżbieta Pacholczuk powołana do funkcji Członka Zarządu ds. ryzyka kieruje pracą Sekcji Zarządzania Ryzykiem Głównymi zadaniami funkcji zarządzania ryzykiem są:• Efektywne wdrażanie systemu zarządzania ryzykiem, w tym strategii zarządzania ryzykiem, polityk ryzyka, standardów biz-nesowych, procesów i procedur zarządzania ryzykiem,• Kierowanie procesami zarządzania ryzykiem należącymi do pro-cesów własnej oceny ryzyka i wypłacalności, w szczególności procesem identyfikacji, pomiaru, zarządzania, monitorowania i raportowania kluczowych ryzyk,• Przegląd i krytyczna ocena czynności należących do procesów zarządzania ryzykiem przeprowadzanych przez pracowników poszczególnych obszarów biznesowych, w szczególności pro-cesu identyfikacji, pomiaru, zarządzania, monitorowania i ra-portowania ryzyka operacyjnego,• Przegląd i krytyczna ocena czynności i decyzji związanych z po-dejmowaniem ryzyka oraz środków mitygujących podejmowa-nych przez właścicieli poszczególnych obszarów biznesowych Towarzystwa, • Raportowanie wyników procesów zarządzania ryzykiem do Za-rządu i Komitetu Audytu i Ryzyka,• Kierowanie procesem raportowania własnej oceny ryzyka i wy-płacalności do Zarządu i KNF.< Wróć do spisu treści;31.12.2018;1;1;95;137
1;12.0;;B.4.1 Funkcja zgodności z przepisami;przepisamiWedług stanu dnia 31 grudnia 2018 roku nadzór nad Funkcją zgod-ności z przepisami Towarzystwa sprawowany był przez Inspektora Ochrony Danych i ds. Compliance, raportującego do Prezesa Zarządu oraz do całego Zarządu. Zgodnie z wytycznymi KNF dotyczącymi Ładu Korporacyjnego, obowiązującymi od 1 stycznia 2015 roku, CCO ma bezpośredni dostęp do Zarządu i Rady Nadzorczej oraz może uczest-niczyć w posiedzeniach tych organów, jeżeli przedmiotem posiedzeń są zagadnienia związane z systemem kontroli wewnętrznej, funkcją audytu wewnętrznego lub compliance. Funkcja zgodności z przepisami obejmuje doradzanie Zarządowi i Radzie Nadzorczej w kwestii zgodności z przepisami oraz ocenę możliwego wpływu zmian otoczenia regulacyjnego na funkcjonowa-nie Towarzystwie oraz ocenę wpływu braku dostosowania się do no-wych regulacji oraz ocenę ryzyka związanego z nieprzestrzeganiem prawa.B.5 Funkcja audytu wewnętrznego;31.12.2018;1;1;95;137
2;11.0;;B.3.3 Proces własnej oceny ryzyka i wypłacalności;wypłacalnościProces własnej oceny ryzyka i wypłacalności Towarzystwa opiera się na szeregu procesów zarządzania ryzykiem przeprowadzanych regu-larnie w ciągu roku. Co najmniej raz w roku osoba nadzorująca funk-cję zarządzania ryzykiem przygotowuje raport ORSA podsumowują-cy wyniki i wnioski z przeprowadzonych procesów. W szczególności proces raportowania ORSA wspiera proces ustalania strategii oraz planowania biznesowego. Raport z przeprowadzenia własnej oceny ryzyka i wypłacalności jest zatwierdzany przez Zarząd Towarzystwa.Poszczególne procesy składające się na własną ocenę ryzyka i wypła-calności są zintegrowane ze strukturą organizacyjną i procesami de-cyzyjnymi Towarzystwa poprzez raportowanie wyników i wniosków z tych procesów do odpowiednich komitetów osadzonych w struk-turze organizacyjnej i zarządczej Towarzystwa. Następujące procesy składają się na własną ocenę ryzyka i wypłacal-ności Towarzystwa:• Proces zarządzania kapitałem, włączając alokację kapitału, mo-nitorowanie, raportowanie oraz testy stresu i analizy scenariu-szowe (raportowanie wyników do Zarządu i Komitetu Audytu i Ryzyka),• Proces ustanawiania strategii oraz planowania biznesowego (ra-portowanie wyników do Zarządu),• Proces zarządzania jakością danych (raportowanie wyników do Komitetu Jakości Danych),• Proces identyfikacji, pomiaru, monitorowania, zarządzania i ra-portowania kluczowych ryzyk (raportowanie wyników do Zarzą-du i Komitetu Audytu i Ryzyka),• Proces identyfikacji, pomiaru, monitorowania, zarządzania i ra-portowania ryzyk operacyjnych (raportowanie wyników do Ko-mitetu Ryzyk Operacyjnych),• Proces raportowania zdarzeń operacyjnych (raportowanie wyni-ków do Komitetu Ryzyk Operacyjnych).Ustalanie własnych potrzeb w zakresie wypłacalności;31.12.2018;1;1;95;137
3;11.0;;B.3.2 System zarządzania ryzykiem;ryzykiemW Towarzystwie istnieje system zarządzania ryzykiem obejmujący strategię zarządzania ryzykiem, polityki ryzyka, standardy biznesowe oraz procesy i procedury zarządzania ryzykiem służące do identyfi-kacji, pomiaru, zarządzania, monitorowania i raportowania ryzyka (na poziomie indywidualnym oraz zagregowanym), na które jest lub może być narażone Towarzystwo. System zarządzania ryzykiem jest efektywny i dobrze zintegrowany ze strukturą organizacyjną, struk-turą komitetów oraz z procesami decyzyjnymi Towarzystwa, z odpo-wiednim uwzględnieniem osób pełniących kluczowe funkcje.Strategia zarządzania ryzykiem, polityki ryzyka i standardy;31.12.2018;1;1;95;137
4;9.0;;B.1.6 Zasady dotyczące wynagradzania;wynagradzaniaTowarzystwo posiada regulacje wewnętrzne określające zasady wy-nagradzania Rady Nadzorczej, Zarządu, osób pełniących kluczowe funkcje w Towarzystwie oraz pracowników. System wynagradzania zapewnia konkurencyjność pakietu wynagrodzeń, który:• jest zgodny z odpowiednią praktyką rynkową,• wspiera realizację strategii Towarzystwa,• sprzyja rozwojowi i bezpieczeństwu działania Towarzystwa,• podkreśla wartości i zachowania obowiązujące w Towarzystwie.Towarzystwo poprzez swoją politykę wynagradzania wspiera reali-zację rocznych i długofalowych celów strategicznych. Programy wy-nagrodzeniowo–motywacyjne Towarzystwa mają na celu zachęcanie do:• rozważnego i roztropnego zarządzania sprawami Towarzystwa,• przestrzegania Kodeksu Etyki Biznesu Towarzystwa,• uczciwego traktowania klientów Towarzystwa przez jego pra-cowników, • przyjmowania przez pracowników Towarzystwa odpowiedzial-nej postawy wobec zarządzania ryzykiem w Towarzystwie.Towarzystwo stosuje system wynagrodzeń obejmujący zarówno sta-łe, jak i zmienne składniki wynagrodzenia, skomponowane w taki sposób, aby stały lub gwarantowany składnik stanowił odpowiednio wysoką część całkowitego wynagrodzenia, co ma na celu zapobie-gać nadmiernemu uzależnieniu pracowników od zmiennych skład-ników oraz pozwala stosować elastyczne zasady dotyczące premii, umożliwiające między innymi niewypłacanie zmiennego składnika wynagrodzenia.Towarzystwo stosuje strukturę wynagrodzeń zmiennych, która odpo-wiada następującym założeniom:• Struktura wynagrodzeń dla wszystkich pracowników Towarzy-stwa nie powinna zachęcać do podejmowania ryzyka wykra-czającego poza apetyt na ryzyko określony dla danej jednostki/obszaru, a w przypadku członków Zarządu musi obejmować cel (cele) związany z ryzykiem, którego realizacja będzie miała istot-ny wpływ na przyznanie i wysokość wynagrodzeń zmiennych dla poszczególnych osób,• Ustalając strukturę wynagradzania, należy unikać konfliktu in-teresów,• Ustalając strukturę wynagradzania, należy kierować się przede wszystkim uczciwym postępowaniem wobec klientów Towarzy-stwa. Struktura wynagradzania powinna zachęcać do jak naj-większej dbałości o klienta Towarzystwa. Nie powinna również stanowić zachęty do łamania zasad zawartych w Kodeksie Etyki Biznesu.Ponadto:• Ustalając wysokość zmiennego wynagrodzenia dla pracownika, należy uwzględnić wyniki Towarzystwa i jednostki biznesowej, w której pracuje dana osoba, wyniki tej osoby w stosunku do celów lub zadań wyznaczonych dla jej stanowiska oraz całkowi-te wynagrodzenie pracownika względem poziomu rynkowego,• Zmienne składniki wynagrodzenia członków Zarządu oraz osób pełniących kluczowe funkcje powinny być uzależnione w szcze-gólności od obiektywnych kryteriów, jakości zarządzania oraz uwzględniać długoterminowe aspekty działania i sposób reali-zacji celów strategicznych. Ustalając zmienne składniki wyna-grodzenia uwzględnia się także nagrody lub korzyści, w tym wynikające z programów motywacyjnych oraz innych progra-mów premiowych wypłaconych, należnych lub potencjalnie na-leżnych,• Towarzystwo przy ustalaniu programów bonusowych może także stosować odroczenia wypłaty części bonusów, mając na względzie przyjęte długofalowe cele Towarzystwa i poziom ich realizacji,• Polityka i zasady wynagradzania członków Rady Nadzorczej, członków Zarządu oraz osób pełniących kluczowe funkcje od-powiadają wymogom dokumentowania i raportowania z po-wszechnie obowiązujących przepisów prawa,• Wynagrodzenie z tytułu pełnienia funkcji w Radzie Nadzorczej przysługuje wyłącznie niezależnym Członkom Rady Nadzorczej,• Wynagrodzenie niezależnych Członków Rady Nadzorczej usta-la się adekwatnie do pełnionej funkcji. Niezależni Członkowie Rady Nadzorczej powołani do pracy w komitetach, w tym w Komitecie Audytu i Ryzyka, wynagradzani są adekwatnie do do-datkowych zadań wykonywanych w ramach danego komitetu,• Wynagrodzenie niezależnych Członków Rady Nadzorczej ustala-ne jest przez Walne Zgromadzenie,• Towarzystwo nie posiada dodatkowych programów emerytal-no-rentowych lub programów wcześniejszych emerytur dla członków organu administrującego, zarządzającego lub nadzor-czego i innych osób nadzorujących kluczowe funkcje.Informacje dotyczące istotnych transakcji zawartych w okre-;31.12.2018;1;1;95;137
5;9.0;;B.1.5 Struktura komitetów;komitetówSystem zarządzania (w szczególności w odniesieniu do zarządzania ryzykiem) jest zorganizowany poprzez strukturę Komitetów, których zadaniem jest wspieranie wydajnych i transparentnych procesów po-dejmowania decyzji. Regulaminy Komitetów określają zakres upraw-nień, cel, role, zakres odpowiedzialności, standardowy porządek po-siedzenia i częstotliwość spotkań Komitetów.Komitety są podzielone na:• Komitety przy Radzie Nadzorczej, których rolą jest informowanie i wspieranie Rady Nadzorczej w pełnieniu swojej funkcji nadzorczej: •;31.12.2018;1;1;95;137
6;9.0;;B.1.4 Alokacja odpowiedzialności i delegowanie uprawnień;uprawnieńStruktura organizacyjna przewiduje wewnętrzny podział odpowie-dzialności za wszystkie obszary działalności pomiędzy Członków Za-rządu.Dwóch Członków Zarządu działając w imieniu Towarzystwa może umocować pracowników Towarzystwa i inne osoby fizyczne bądź prawne do reprezentowania Towarzystwa i podejmowania określo-nych w umocowaniu decyzji w imieniu Towarzystwa w określonych sprawach. Zarząd jest kierownikiem Towarzystwa w rozumieniu przepisów o rachunkowości i kieruje podległymi jednostkami orga-nizacyjnymi.W celu realizacji określonych zadań Zarząd może powoływać zespoły - stałe i doraźne składające się z przedstawicieli jednostek organiza-cyjnych. Nazwa zespołu stałego, jego skład, zasady i zakres działania oraz zakres kompetencji są określane uchwałą Zarządu.B.1.5 Struktura komitetów;31.12.2018;1;1;95;137
7;9.0;;B.1.3 Zarząd;ZarządZarząd prowadzi sprawy Towarzystwa i reprezentuje je. Wszelkie sprawy, nie zastrzeżone na mocy przepisów prawa lub statutu To-warzystwa do kompetencji ego innych organów, należą do zakresu działania Zarządu. Do zadań Zarządu należy m.in.:• Wdrażanie Planu Biznesowego,• Zapewnianie realizacji celów określonych w Rocznym Budżecie,• ścisła współpraca z Santander Bank Polska S.A. w celu realizacji celów Spółki,• Wybór podmiotów odpowiedzialnych za zarządzanie aktywami Spółki,• zawieranie umów reasekuracji, • Zawieranie innych umów w imieniu Spółki,• Udzielanie i odwoływanie prokur i pełnomocnictw,• Podejmowanie decyzji w innych sprawach wniesionych przez Członków Zarządu lub inne uprawnione organy,• Opracowywanie i zatwierdzanie regulaminów wewnętrznych określających sposób prowadzenia działalności ubezpieczenio-wej, jak i innych regulaminów wymaganych przepisami prawa, chyba że kompetencja ta została zastrzeżona postanowieniem Statutu dla Rady lub Walnego Zgromadzenia.Na dzień 31 grudnia 2018 struktura Zarządu wraz z przypisaniem odpowiedzialności prezentowała się następująco: Krzysztof Charchuła;31.12.2018;1;1;95;137
8;9.0;;B.1.2 Rada Nadzorcza;NadzorczaRada Nadzorcza sprawuje stały nadzór nad działalnością Spółki we wszystkich jej dziedzinach, w sposób zgodny ze Statutem, obowią-zującymi przepisami prawa i wymogami regulacyjnymi oraz obo-wiązującymi zasadami ładu korporacyjnego. Rada Nadzorcza działa na podstawie kodeksu spółek handlowych, ustawy o działalności ubezpieczeniowej i reasekuracyjnej, Statutu oraz Regulaminu Rady Nadzorczej. Do szczególnych obowiązków Rady należy ocena spra-wozdań finansowych oraz wniosków Zarządu dotyczących podziału zysku albo pokrycia straty, a także składanie Walnemu Zgromadzeniu corocznego pisemnego sprawozdania z wyników tej oceny. Zgodnie z postanowieniami Statutu i Regulaminu Rady Nadzorczej, Zarząd konsultuje się z tym organem w kluczowych dla Spółki sprawach, a określone decyzje wymagają zgody Rady. Rada Nadzorcza działa kolegialnie, m.in. podejmuje uchwały, wydaje zalecenia i opinie oraz wnioskuje do Walnego Zgromadzenia. W celu prawidłowego wykonywania swoich obowiązków Rada Nadzorcza otrzymuje od Zarządu regularne i wyczerpujące informacje o wszyst-kich istotnych sprawach dotyczących Spółki oraz o ryzyku związanym z prowadzoną działalnością i sposobach zarządzania ryzykiem. Rada Nadzorcza może badać wszystkie dokumenty Spółki, żądać od Zarządu i pracowników sprawozdań i wyjaśnień oraz dokonywać re-wizji stanu majątku Spółki. Na dzień 31 grudnia 2018 w skład Rady Nadzorczej wchodzili:• Maciej Jankowski – Przewodniczący Rady Nadzorczej,• Arkadiusz Przybył – Członek Rady Nadzorczej,• Francisco del Cura Ayuso – Członek Rady Nadzorczej,• Adam Śliwiński – Członek Rady Nadzorczej,• Piotr Głowski – Członek Rady Nadzorczej,• Marcin Murawski – Członek Rady Nadzorczej,• Ewa Jac – Członek Rady Nadzorczej.Ze skutkiem od dnia 20 marca 2018 roku Santander Bank Polska S.A. powołał do Rady Nadzorczej Towarzystwa Pana Arkadiusza Przybyła, który zastąpił Pana Mirosława Skibę (rezygnacja ze skutkiem od dnia 19 marca 2018 roku). Rada Nadzorcza powołuje Komitet Audytu i Ryzyka ze swoich człon-ków. Komitet ten wspomaga Radę Nadzorczą w zakresie nadzoru nad sprawozdawczością finansową (w szczególności monitorowanie procesu sprawozdawczości finansowej oraz wykonywanie czynności rewizji finansowej) oraz nad zarządzaniem ryzykiem w Spółce (m.in. monitorowanie skuteczności systemów kontroli wewnętrznej, audy-tu wewnętrznego i zarządzania ryzykiem).Skład Komitetu Audytu i Ryzyka Spółki na dzień bilansowy stanowiły następujące osoby:• Marcin Murawski – Przewodniczący Komitetu (niezależny),• Adam Śliwiński – Członek Komitetu (niezależny),• Ewa Jac – Członek Komitetu. Santdaner Aviva Towarzystwo;31.12.2018;1;1;95;137
9;9.0;;B.1.1 Struktura organizacyjna;organizacyjnaZgodnie z zasadami określonymi w Ustawie o działalności ubezpie-czeniowej i reasekuracyjnej, system zarządzania opiera się na czte-rech kluczowych funkcjach: • Funkcji zarządzania ryzykiem,• Funkcji zgodności z przepisami,• Funkcji audytu wewnętrznego - czynności audytu wewnętrzne-go zostały zlecone na zewnątrz na podstawie umowy zlecenia usług audytu zawartej z Aviva Sp. z o.o. oraz Santander Bank Polska S.A.,• Funkcji aktuarialnej. < Wróć do spisu treści;31.12.2018;1;1;95;137
10;3.0;;A.1.5 Istotne linie biznesowe zakładu oraz istotne obszary geograficzne, na których zakład prowadzi działalność;działalnośćPodstawowym przedmiotem działalności Towarzystwa jest działal-ność ubezpieczeniowa w zakresie: • Ubezpieczenia wypadku, w tym wypadku przy pracy i choroby zawodowej,• Ubezpieczenia choroby,• Ubezpieczenia szkód, obejmujące szkody rzeczowe, spowodo-wane przez żywioły: ogień, eksplozję, burzę, inne żywioły, ener-gię jądrową, obsunięcia ziemi lub tąpnięcia,• Ubezpieczenia pozostałych szkód rzeczowych, wywołanych przez grad lub mróz oraz inne przyczyny (jak np. kradzież), jeżeli przyczyny te nie są ujęte w grupie wskazanej powyżej,• Ubezpieczenia odpowiedzialności cywilnej (ubezpieczenie od-powiedzialności cywilnej ogólnej),• Ubezpieczenia ryzyk finansowych, w tym: ryzyka utraty zatrud-nienia, niewystarczającego dochodu, złych warunków atmosfe-rycznych, utraty zysków, stałych wydatków ogólnych, nieprze-widzianych wydatków handlowych, utraty wartości rynkowej, utraty stałego źródła dochodu, pośrednich strat handlowych (poza wymienionymi), innych strat finansowych,• Ubezpieczenia świadczenia pomocy na korzyść osób, które po-padły w trudności w czasie podróży lub podczas nieobecności w miejscu zamieszkania.Dla celów sprawozdawczości zgodnie z założeniami dyrektywy Wy-płacalność II, implementowanymi do polskiego porządku prawnego w Ustawie o działalności ubezpieczeniowej i reasekuracyjnej, działal-ność Towarzystwa jest zaklasyfikowana w ramach następujących linii biznesowych związanych z ubezpieczeniami innymi niż ubezpiecze-nia na życie (bezpośrednia działalność ubezpieczeniowa oraz rease-kuracja czynna):• Ubezpieczenia pokrycia kosztów świadczeń medycznych,• Ubezpieczenia na wypadek utraty dochodów,• Ubezpieczenia od ognia i innych szkód rzeczowych,• Ubezpieczenia odpowiedzialności cywilnej ogólnej,• Ubezpieczenia świadczenia pomocy,• Ubezpieczenia różnych strat finansowych.Linie biznesowe Wypłacalność II stosuje się na potrzeby kalkulacji kapi-tałowego wymogu wypłacalności i minimalnego wymogu kapitałowe-go, oraz raportowania ilościowego w zakresie składek, odszkodowań, kosztów i rezerw techniczno – ubezpieczeniowych.Obszarem geograficznym właściwym dla prowadzonej działalności ubezpieczeniowej jest Rzeczpospolita Polska.Aviva - COFCO Life Insurance Company LimitedAviva Group Holdings Limited 100%General Accident plcAviva plcSantander Aviva Towarzystwo Ubezpieczeń S.A51%Aviva Inernational Holdings Limited 100%< Wróć do spisu treści;31.12.2018;1;1;95;137
11;3.0;;A.1.4 Informacje dotyczące udziałowców posiadających znacz-ne pakiety akcji zakładu;zakładuAkcjonariuszami Towarzystwo są:• Aviva International Holdings Ltd. - 51% akcji, • Santander Bank Polska S.A. - 49% akcji.Towarzystwo należy do grupy kapitałowej Aviva plc. Ponadto pod-miotami powiązanymi dla Towarzystwa są jednostki wchodządze w skład grupy Banco Santander.Poniższy schemat prezentuje uproszczoną strukturę grupy kapitało-;31.12.2018;1;1;95;137
12;3.0;;A.1.3 Dane Biegłego Rewidenta Zakładu;ZakładuBiegłym Rewidentem Towarzystwa jest BDO Spółka z ograniczoną odpowiedzialnością sp.k.z siedzibą w Warszawie, przy ul. Postępu12, 02-676 Warszawa, wpisany na listę podmiotów uprawnionych do badania sprawozdań finansowych pod numerem 3355. Kluczowym biegłym rewidentem Towarzystwa jest Edyta Kalińska, wpisany na listę Krajowych Biegłych Rewidentów pod numerem 10336.A.1.4 Informacje dotyczące udziałowców posiadających znacz-;31.12.2018;1;1;95;137
13;3.0;;A.1.2 Nazwa i dane kontaktowe organu nadzoru odpowie-dzialnego za nadzór finansowy nad zakładem;zakłademOrganem nadzoru, odpowiedzialnym za nadzór finansowy nad To-warzystwem jest Komisja Nadzoru Finansowego, z siedzibą w War-szawie przy ulicy Pięknej 20.A.1.3 Dane Biegłego Rewidenta Zakładu;31.12.2018;1;1;95;137
14;31.0;37.0;E.6 Wszelkie inne informacje >;ryzyka;31.12.2018;1;1;95;137
15;31.0;36.0;E.5 Niezgodność z minimalnym wymogiem kapitałowym i niezgodność z kapitałowym wymogiem wypłacalności;dodatkowe na dzień 31 grudnia 2018 roku oraz za okres porównawczy;31.12.2018;1;1;95;137
16;31.0;35.0;E.4 Różnice między formułą standardową a stosowanym modelem wewnętrznym >;z minimalnym wymogiem kapitałowym i niezgodność z kapitałowym wymogiem wypłacalności;31.12.2018;1;1;95;137
17;31.0;34.0;E.3 Zastosowanie podmodułu ryzyka cen akcji opartego na duracji do obliczenia kapitałowego wymogu wypłacalności;wypłacalności Towarzystwo nie stosuje podmodułu ryzyka cen akcji opartego na duracji do obliczania kapitałowego wymogu wypłacalności.E.4 Różnice między formułą standardową;31.12.2018;1;1;95;137
18;31.0;33.0;E.2 Kapitałowy wymóg wypłacalności i minimalny wymóg kapitałowy >;podmodułu ryzyka cen akcji opartego na duracji do obliczenia kapitałowego;31.12.2018;1;1;95;137
19;31.0;32.0;E.1 Środki własne >;wymóg wypłacalności i minimalny wymóg kapitałowy;31.12.2018;1;1;95;137
20;25.0;29.0;D.4 Alternatywne metody wyceny >;kapitałem;31.12.2018;1;1;95;137
21;25.0;28.0;D.3 Inne zobowiązania >;metody wyceny;31.12.2018;1;1;95;137
22;25.0;27.0;D.2 Rezerwy techniczno-ubezpieczeniowe >;zobowiązania;31.12.2018;1;1;95;137
23;25.0;26.0;D.1 Aktywa >;techniczno-ubezpieczeniowe;31.12.2018;1;1;95;137
24;17.0;23.0;C.6 Pozostałe istotne ryzyka >;ważne informacje;31.12.2018;1;1;95;137
25;17.0;22.0;C.5 Ryzyko operacyjne >;istotne ryzyka;31.12.2018;1;1;95;137
26;17.0;21.0;C.4 Ryzyko płynności >;operacyjne;31.12.2018;1;1;95;137
27;17.0;20.0;C.3 Ryzyko kredytowe >;płynności;31.12.2018;1;1;95;137
28;17.0;19.0;C.2 Ryzyko rynkowe >;kredytowe;31.12.2018;1;1;95;137
29;17.0;18.0;C.1 Ryzyko aktuarialne >;rynkowe;31.12.2018;1;1;95;137
30;8.0;15.0;B.7 Outsourcing >;inne informacje;31.12.2018;1;1;95;137
31;8.0;14.0;B.6 Funkcja aktuarialna >;;31.12.2018;1;1;95;137
32;8.0;13.0;B.5 Funkcja audytu wewnętrznego >;aktuarialna;31.12.2018;1;1;95;137
33;8.0;12.0;B.4 System kontroli wewnętrznej >;zgodności z przepisami;31.12.2018;1;1;95;137
34;8.0;11.0;B.3 System zarządzania ryzykiem, w tym własna ocena ryzyka i wypłacalności >;zarządzania ryzykiem;31.12.2018;1;1;95;137
35;8.0;10.0;B.2 Wymogi dotyczące kompetencji i reputacji >;zarządzania ryzykiem, w tym własna ocena ryzyka i wypłacalności;31.12.2018;1;1;95;137
36;8.0;9.0;B.1 Informacje ogólne o systemie zarządzania >;organizacyjna;31.12.2018;1;1;95;137
37;2.0;6.0;A.4 Wyniki z pozostałych rodzajów działalności >;zarządzania;31.12.2018;1;1;95;137
38;2.0;5.0;A.3 Wynik z działalności lokacyjnej (inwestycyjnej) >;z pozostałych rodzajów działalności;31.12.2018;1;1;95;137
39;2.0;4.0;A.2 Wynik z działalności ubezpieczeniowej >;z działalności lokacyjnej (inwestycyjnej);31.12.2018;1;1;95;137
40;2.0;3.0;A.1 Działalność i wyniki operacyjne >A.1Działalność >;i forma prawna zakładu;31.12.2018;1;1;95;137
