;ID_SEKCJA NADRZĘDNA;ID_SEKCJA;NAZWA_SEKCJI;TREŚĆ;DATA SFCR;WERSJA SFCR;KOD ZAKŁADU;KOD ZAKLADU;ID_TAB
0;;;Podsumowanie PodsumowaniePodstawa sporządzenia;o wypłacalności i kondycji finansowej PKO Życie Towarzystwo Ubezpieczeń S.A. na dzień 31 grudnia 2016 roku oraz za rok obrotowy zakończony tego dnia, zwane dalej „Sprawozdaniem” zostały przygotowane w celu wypełnienia wymogów art. 284 Ustawy. Sprawozdanie zostało przygotowane zgodnie z mającymi zastosowanie przepisami Ustawy, Aktu Delegowa-nego, Rozporządzenia wykonawczego oraz Wytycznymi EIOPA. Wycena aktywów i zobowiązań (w tym rezerw techniczno-ubezpieczeniowych) została wykonana w oparciu o przepisy Ustawy, Aktu Delegowanego oraz Wytycznych EIOPA, a przyjęte zasady zostały opisane w części D Sprawozdania. Wartość środków własnych została ustalona na podstawie Ustawy, Aktu Delegowanego oraz Wytycznych EIOPA w sprawie klasyfikacji środków własnych. SCR obliczany jest na podstawie formuły standardowej w oparciu o zasady opisane w Ustawie, Akcie Delegowanym oraz Wytycznych EIOPA. Wszystkie obliczenia dotyczące poszczególnych modułów i podmodułów ryzyka oparto na metodach określonych w Akcie Delegowanym.Sprawozdanie obejmuje rok 2016 i prezentuje dane według stanu na dzień 31 grudnia 2016 roku. Sprawozdanie zostało przygotowane z uwzględnieniem wszystkich dostępnych danych według stanu na dzień 31 grudnia 2016 roku, przy czym opisano istotne zmiany, które nastąpiły w działalności PKO Życie Towarzystwa Ubezpieczeń S.A. do daty sporządzenia Sprawozdania. W Sprawozdaniu zostały zaprezentowane dane Towarzystwa w tysiącach złotych. W raporcie od-niesiono się do wymagań regulacji opisanych powyżej, w takim zakresie, w jakim dotyczą one Towarzystwa. W przypadku braku odniesienia do konkretnego artykułu, oznacza to, że ujawnienia w jego zakresie nie mają zastosowania.Sprawozdanie składa się z następujących części:• Podsumowanie• A. Działalność i wyniki operacyjne,• B. System zarządzania,• C. Profil ryzyka,• D. Wycena dla celów wypłacalności,• E. Zarządzanie kapitałem,• Załączniki – roczne dane i informacje ilościowe. Niniejsze Sprawozdanie było przedmiotem badania przez podmiot uprawniony do badania sprawozdań finansowych.Streszczenie zarządcze;10.10.2014;1;1;27;122
1;33.0;;E.2.2 Minimalny wymóg kapitałowy;kapitałowyMinimalny wymóg wypłacalności oraz jego składowe zostały zaprezentowane w tabeli poniżej.Tabela E.2.2. Minimalny wymógł kapitałowy (w tys. zł)Wartość na dzień;10.10.2014;1;1;27;122
2;32.0;;E.1.5 Wyjaśnienie rezerwy uzgodnieniowej;uzgodnieniowejZgodnie ze stanem na dzień 31.12.2016r. rezerwa uzgodnieniowa wyniosła 94 324 tys. zł. Do najistotniejszych elementów składowych rezerwy uzgodnieniowej należą:• Rezerwy techniczno-ubezpieczeniowe / Rezerwy techniczno-ubezpieczeniowe obliczane łącznie jako najlepsze oszacowanie oraz margines ryzyka – zmiany wynikają z zastąpienia pozycji rezerwy techniczno-ubezpieczeniowe brutto w bilansie statutowym wartościami najlepszego oszacowania oraz marginesu ryzyka zgodnie z bilansem dla celów wypłacalności (zgodnie z Rozdziałem 3 Rozporządzenia Delegowanego Komisji Europejskiej z dnia 10 października 2014 r.). Ujęcie rezerw techniczno-ubezpieczeniowych zostało szczegółowo opisane w punkcie D.2.• Aktywowane koszty akwizycji – różnica wynika z faktu, iż w bilansie dla celów wypłacalności wykazywane są one w wartości zero, jako koszty w części przypadającej na przyszłe okresy sprawozdawcze, zgodnie z zasadami ogólnymi wyceny przedstawionymi w art. 9 Rozporządzenia Delegowanego Komisji Europejskiej z dnia 10 października 2014 r. Należy tutaj mieć na uwadze postanowienia zawarte w MSSF 4. Podejście to zostało opisane w punkcie D.1.1.E.2 Kapitałowy wymóg wypłacalności i minimalny wymóg kapitałowy;10.10.2014;1;1;27;122
3;32.0;;E.1.3 Różnice w wartości kapitału dla celów statutowych a celów wypłacalności;wypłacalnościRóżnice w wartości kapitału wykazywanego dla celów statutowych w porównaniu z nadwyżką aktywów nad zobowiązaniami obliczoną dla celów wypłacalności wynikają przede wszystkim z faktu, iż Towarzystwo podczas tworzenia bilansu statutowe-go stosuje politykę opartą na Ustawie o rachunkowości. Metody wyceny zawarte w ustawie w znacznym stopniu różnią się od tych stosowanych dla celów wypłacalności, które z kolei bliższe są w swojej wykładni do Międzynarodowych Standardów Sprawozdawczości Finansowej. Ponadto Rozporządzenie Delegowane Komisji Europejskiej z dnia 10 października 2014r. ściśle określa podejście do wyceny poszczególnych składników bilansu, wprowadzając inne metody wyceny i podziału jego skła-dowych. Szczegółowe informacje ilościowe w zakresie korekt dla poszczególnych pozycji bilansu ekonomicznego znajdują się w rozdziale D. Tabela E.1.2. Różnice w wartości kapitału dla celów statutowych a celów wypłacalności w PKO Życie SA (w tys. zł)Wartość na dzień;10.10.2014;1;1;27;122
4;32.0;;E.1.2 Informacja dotycząca struktury środków własnych;własnychŚrodki własne na potrzeby adekwatności kapitałowej wyliczane są zgodnie z przepisami zawartymi w ustawie Środki własne Towarzystwa składają się tylko z kapitału podstawowego Kategorii 1. Kapitał zakładowy oraz nadwyżka ze sprzedaży akcji powyżej ich wartości nominalnej związana z kapitałem zakładowym w danym okresie sprawozdawczym tj. w trakcie 2016 roku nie uległy zmianom.Struktura środków własnych w Spółce zgodnie ze stanem na 31 grudnia 2016 roku prezentuje się następująco:• Kategoria 1 podstawowych środków własnych, to: –Nadwyżka aktywów nad zobowiązaniami (245 979 tys. zł) –Opłacony kapitał zakładowy (147 332 tys. zł) –Rezerwa uzgodnieniowa (94 324 tys. zł)Spółka nie posiada innych kategorii środków własnych w swojej strukturze kapitałowejW poniższej tabeli zaprezentowano strukturę środków własnych Towarzystwa w ujęciu wartościowym zgodnym ze stanem na dzień 31.12.2016 r.Tabela E.1.1. Struktura środków własnych w PKO Życie SA (w tys. zł)Wartość na dzień;10.10.2014;1;1;27;122
5;28.0;;D.3.6 Pozostałe zobowiązania (niewykazane w innych pozycjach);pozycjach)W bilansie ekonomicznym w pozostałych zobowiązaniach niewykazanych w innych pozycjach Towarzystwo prezentuje głównie zobowiązania wobec Skarbu Państwa (podatki, ZUS).Metodyka wyceny jest analogiczna jak w przypadku pozostałych zobowiązań (handlowe, inne niż z tytułu działalności ubezpie-czeniowej). W pozycji tej w kolumnie „Wartość wg PSR” zostały zaprezentowane saldo funduszy specjalnych (ZFŚS) w wysokości 154 tys. zł., które podlega eliminacji w bilansie ekonomicznym w ramach korekt wyceny do wartości godziwej. Poza tą korektą, na dzień 31.12.2016 nie zidentyfikowano innych istotnych korekt w stosunku do danych wg PSR. 58Sprawozdanie o wypłacalności i kondycji finansowej PKO Życie Towarzystwo Ubezpieczeń S.A.;10.10.2014;1;1;27;122
6;28.0;;D.3.5 Pozostałe zobowiązania (handlowe, inne niż z tytułu działalności ubezpieczeniowej);ubezpieczeniowej)W zakresie pozostałych zobowiązań (handlowe, inne niż z tytułu działalności ubezpieczeniowej) Towarzystwo w bilansie ekono-micznym prezentuje zobowiązania handlowe, kwoty należne pracownikom i dostawcom, których termin lub kwota są pewne.W bilansie ekonomicznym Towarzystwo wycenia zobowiązania z tytułu reasekuracji alternatywną metodą wyceny opisaną w pkt D.4.W bilansie statutowym Towarzystwo wycenia pozostałe zobowiązania w kwocie wymagającej zapłaty.Na dzień 31.12.2016 Spółka nie identyfikowała różnicy w wycenie innych zobowiązań na potrzeby bilansu ekonomicznego w stosunku do sprawozdania finansowego. D.3.6 Pozostałe zobowiązania (niewykazane w innych pozycjach);10.10.2014;1;1;27;122
7;28.0;;D.3.4 Zobowiązania z tytułu reasekuracji biernej;biernejW pozycji tej ujmowane są wymagalne zobowiązania z tytułu reasekuracji. Zobowiązania nieprzeterminowane ujmowane są w wycenie pozycji „Kwoty należne z umów reasekuracji” jako przyszłe przepływy pieniężne. W bilansie statutowym zobowiązania z tytułu reasekuracji obejmują kwoty zarówno wymagalne i niewymagalne a ich wycena następuje wg wartości wymagającej zapłaty.Na dzień 31.12.2016 100% zobowiązań stanowiło zobowiązania niewymagalne i dlatego zostały uwzględnione jako przyszłe przepływy pieniężne w kwotach należnych z umów reasekuracji.D.3.5 Pozostałe zobowiązania (handlowe, inne niż z tytułu działalności;10.10.2014;1;1;27;122
8;28.0;;D.3.3 Zobowiązania z tytułu ubezpieczeń i wobec pośredników ubezpieczeniowych;ubezpieczeniowychW ramach omawianej linii sprawozdawczej prezentowane są jedynie wymagalne (przeterminowane) składniki zobowiązań. Składniki niewymagalne (nieprzeterminowane) ujmowane są w najlepszym oszacowaniu rezerw (BEL), jako przyszłe przepływy pieniężne. W bilansie ekonomicznym Towarzystwo wycenia zobowiązania z tytułu ubezpieczeń i wobec pośredników ubezpieczeniowych alternatywną metodą wyceny opisaną w punkcie D4. 57Sprawozdanie o wypłacalności i kondycji finansowej PKO Życie Towarzystwo Ubezpieczeń S.A.;10.10.2014;1;1;27;122
9;28.0;;D.3.2 Rezerwy z tytułu odroczonego podatku dochodowego;dochodowegoDla celów wypłacalności Towarzystwo ujmuje i wycenia podatki odroczone stosownie do art. 15 Rozporządzenia Delegowane-go Komisji (UE). Spółka rozpoznaje podatek odroczony w ujęciu netto jako aktywo lub rezerwę z tytułu odroczonego podatku dochodowego. Podstawą do rozpoznania podatku odroczonego na bilansie ekonomicznym są dwa elementy.Pierwszym, bazowym składnikiem jest podatek odroczony rozpoznany w sprawozdaniu finansowym zgodnie z obowiązującymi w Towarzystwie zasadami rachunkowości. Drugim składnikiem podatku odroczonego na bilansie ekonomicznym są różnice przejściowe (w tabeli w kolumnie korekta wyceny) pomiędzy bilansem, będącym częścią sprawozdania finansowego Towarzy-stwa, a bilansem ekonomicznym.D.3.3 Zobowiązania z tytułu ubezpieczeń i wobec pośredników;10.10.2014;1;1;27;122
10;28.0;;D.3.1 Pozostałe rezerwy, inne niż rezerwy techniczno-ubezpieczeniowe, zobowiązania z tytułu świadczeń emerytalnych dla pracowników;pracownikówW zakresie pozostałych rezerw Towarzystwo w bilansie ekonomicznym prezentuje pozostałe zobowiązania, których termin lub kwota są niepewne z wyłączeniem wykazanych w pozycji „Zobowiązania z tytułu świadczeń emerytalnych dla pracowników”. W bilansie ekonomicznym Towarzystwo wycenia pozostałe rezerwy alternatywną metodą wyceny opisaną w pkt D.4D.3.2 Rezerwy z tytułu odroczonego podatku dochodowego;10.10.2014;1;1;27;122
11;27.0;;D.2.5 Istotne zmiany w założeniach;założeniachJako że przedmiotowy raport jest pierwszym sprawozdaniem na temat wypłacalności i kondycji finansowej, to brak okresu porównawczego. Jednocześnie w trakcie 2016 roku nie nastąpiły istotne zmiany metodologii określania założeń dotyczących obliczania rezerw techniczno-ubezpieczeniowych na cele wypłacalności (Spółka odnosi się do naliczeń wymogów kapitało-wych i środków własnych na bilans otwarcia 2016 roku, które nie były publikowane). W zakresie istotnych zmian parame-trów najważniejsza zmiana dotyczy uaktualnienia wskaźników kosztów jednostkowych, które uległy zmniejszeniu ze względu na przyrost portfela, przy jednoczesnym planowaniu ograniczeniu kosztów łącznych Towarzystwa w kolejnych dwóch latach.D.3 Inne zobowiązania;10.10.2014;1;1;27;122
12;27.0;;D.2.4 Kwoty należne z umów reasekuracji;reasekuracjiKwoty należne z umów reasekuracji są obliczane zgodnie z zapisami zawartych przez Spółkę umów reasekuracji. W ramach kwot należnych z umów reasekuracji wykazywane są: nierozliczone na dzień bilansowy składki reasekuracyjne (ze znakiem ujemnym), prowizje reasekuracyjne i udziały w zyskach reasekuratora. Wartość nierozliczonych na dzień bilansowy udziałów reasekuratora w wypłaconych świadczeniach prezentowane są w pozycji „Pozostałe aktywa (niewykazane w innych pozy-cjach)”. Wartość należności jest powiększana o wartość zdyskontowaną spodziewanych przyszłych płatności od reasekuratora z tytułu rozliczeń za przyszłe okresy, gdzie płatności te są różnicą pomiędzy przyszłymi składkami na udziale reasekuratora a prowizjami na udziale reasekuratora, świadczeniami na udziale reasekuratora i udziałami w zyskach reasekuratora. W ramach kalkulacji spodziewanych płatności uwzględniane jest prawdopodobieństwo niewykonania zobowiązania przez kontrahenta.D.2.5 Istotne zmiany w założeniach;10.10.2014;1;1;27;122
13;27.0;;D.2.3 Różnice pomiędzy metodologią wyceny rezerw do celów wypłacalności a metodologią wyceny rezerw na potrzeby sprawozdań finansowych;finansowychTabela poniżej zawiera istotne różnice pomiędzy podstawami, metodami i głównymi założeniami stosowanymi do wyceny do celów wypłacalności i na potrzeby sprawozdań finansowych dla wszystkich linii biznesowych, tj.:• Ubezpieczenia, w których świadczenie jest ustalane w oparciu o określone indeksy lub inne wartości bazowe i ubezpiecze-nia związane z ubezpieczeniowym funduszem kapitałowym (linia biznesowa nr 1),• Pozostałe ubezpieczenia na życie (linia biznesowa nr 2).Porównanie różnic prezentowane jest przez pryzmat klasyfikacji rezerw używanej na potrzeby sprawozdań finansowych, z dodatkową kategorią („Margines ryzyka”) występującą jedynie w przypadku rezerw tworzonych do celów wypłacalności. Ze względu na fakt, że tabela prezentuje istotne różnice, prezentowane jest porównanie dla czterech (z siedmiu) kategorii rezerw. Pozostałe trzy kategorie (rezerwa na ryzyka niewygasłe, rezerwa na premie i rabaty dla ubezpieczonych, pozostałe rezerwy techniczno-ubezpieczeniowe) nie występują lub są niematerialne (łączna wartość rezerwy na potrzeby sprawozdania finanso-wego poniżej 28 tys. zł, udział w całości rezerw ok. 0,001% wszystkich rezerw), a jednocześnie w rezerwach na cele wypłacal-ności są uwzględnione w tej samej kategorii co rezerwa ubezpieczeń na życie / rezerwa ubezpieczeń na życie, gdy ryzyko lokaty ponosi ubezpieczający.53Sprawozdanie o wypłacalności i kondycji finansowej PKO Życie Towarzystwo Ubezpieczeń S.A.;10.10.2014;1;1;27;122
14;27.0;;D.2.2 Opis poziomu niepewności związanej z wartością rezerw techniczno-ubezpieczeniowych;techniczno-ubezpieczeniowychNa niepewności rezerw techniczno-ubezpieczeniowych na cele wypłacalności mają wpływ:1. Zmiany regulacyjne, w szczególności mogące wpływać na zmianę wysokości wypłacanych świadczeń (w tym wartości wykupów z produktów unit-linked), czy zwiększenie roszczeń klientów z umów już rozwiązanych ponad spodziewany poziom.2. Zmiany w realizacji tablic zajść zdarzeń (bieżąca szkodowość) w stosunku do dotychczasowo obserwowanej empiryki, zmiany w charakterystyce zachowań klientów (w szczególności w zakresie rezygnacji z umów ubezpieczeń). 3. Zmiany w poziomie kosztów jednostkowych (koszt per polisa), które mogą wynikać ze zmian w zakładanych poziomach łącznych kosztów obsługowych (relatywnie krótki okres planowania finansowego w stosunku do długości prognozowa-nych przepływów finansowych z zawartych umów ubezpieczenia) jak i ze zmiany struktury i wolumenu portfela, będącego bazą do określania kosztów jednostkowych.Niepewności z punktów 2. i 3. są związane z ryzykiem naturalnego odchylenia się realizacji zmiennej losowej od jej wartości oczekiwanej, i krótkookresowe odchylenia nie muszą świadczyć o niewłaściwie dobranych założeniach.Spółka analizuje odchylenia szkodowości oraz poziomów rezygnacji umów w ramach analiz zgodności planów finansowych (opierających się na założeniach zgodnych z założeniami używanymi do kalkulacji rezerw techniczno-ubezpieczeniowych na cele wypłacalności) z ich realizacją. W ramach kosztów jednostkowych Spółka analizuje w trybie rocznym zmiany założeń, wyjaśniając przyczynę ich zmian. Niepewność związana ze zmianami regulacyjnymi i ich wpływ na poziom rezerw techniczno--ubezpieczeniowych analizowana jest przez Spółkę m.in. w ramach procesu ORSA, jak również w ramach osobnych analiz ad-hoc w sytuacji identyfikacji nowego ryzyka.D.2.3 Różnice pomiędzy metodologią wyceny rezerw do celów wypłacalności;10.10.2014;1;1;27;122
15;26.0;;D.1.9 Środki pieniężne i ekwiwalenty środków pieniężnych;pieniężnychW zakresie środków pieniężnych i ekwiwalentów środków pieniężnych Towarzystwo stosuje wycenę wg wartości godziwej metodą alternatywną opisaną w punkcie D4.D.2 Rezerwy techniczno-ubezpieczeniowe;10.10.2014;1;1;27;122
16;26.0;;D.1.8 Należności z tytułu ubezpieczeń i od pośredników ubezpieczeniowych;ubezpieczeniowychW bilansie ekonomicznym w pozycji tej prezentowane są jedynie przeterminowane należności od ubezpieczających, zakładów ubezpieczeń oraz inne związane z działalnością ubezpieczeniową, nie ujęte w przepływach pieniężnych w najlepszym oszacowa-niu rezerw techniczno-ubezpieczeniowych (BEL).Towarzystwo wycenia należności z tytułu ubezpieczeń i od pośredników ubezpieczeniowych alternatywną metodą wyceny opisaną w punkcie D4.W bilansie statutowym należności z tytułu ubezpieczeń i od pośredników ubezpieczeniowych obejmują kwoty zarówno wyma-galne i niewymagalne a ich wycena następuje wg wartości nominalnej pomniejszonej o odpisy z tytułu utraty wartości. Ujęta korekta wartości między bilansem ekonomicznym a bilansem statutowym w całości wynika z ujęcia niewymagalnych należno-ści w najlepszym oszacowaniu rezerw jako przyszłe przepływy pieniężne.51Sprawozdanie o wypłacalności i kondycji finansowej PKO Życie Towarzystwo Ubezpieczeń S.A.;10.10.2014;1;1;27;122
17;26.0;;D.1.7 Kwoty należne z umów reasekuracji;reasekuracji Wyznaczanie wartości kwot należnych z umów reasekuracji opiera się na metodyce aktuarialnej, obejmującej wyliczenie ocze-kiwanych przepływów pieniężnych związanych z rozliczeniami z reasekuratorem (zob. opis w podrozdziale D.2.4). W bilansie statutowym kwoty należne z umów reasekuracji nie występują w aktywach. Odpowiednikiem tych kwot jest udział reasekuratora w rezerwach, wyznaczany na podstawie zapisów umów reasekuracyjnych określających poziom cedowanego ryzyka na poziomie pojedynczej polisy w ramach rezerwy składki i rezerwy szkodowej (dla szkód zgłoszonych) oraz rezerwy ubez-pieczeń na życie (w ramach rezerwy na skapitalizowaną wartość rent)..D.1.8 Należności z tytułu ubezpieczeń i od pośredników;10.10.2014;1;1;27;122
18;26.0;;D.1.6 Aktywa dla ubezpieczeń na życie, w których świadczenie jest ustalane w oparciu o określone indeksy lub inne wartości bazowe i ubezpieczeń na życie związanych z ubezpieczeniowym funduszem kapitałowym;kapitałowymW pozycji tej ujmowane są, jednostki uczestnictwa funduszy. Towarzystwo stosuje metodę wyceny opisaną w pkt D.1.5. D.1.7 Kwoty należne z umów reasekuracji;10.10.2014;1;1;27;122
19;26.0;;D.1.5 Lokaty (inne niż aktywa dla ubezpieczeń na życie, w których świadczenie jest ustalane w oparciu o określone indeksy lub inne wartości bazowe i dla ubezpieczeń na życie związanych z ubezpieczeniowym funduszem kapitałowym)D.1.5.1 Udziały w jednostkach powiązanych, w tym udziały kapitałowe;kapitałoweWycena udziałów w jednostkach powiązanych przeprowadzana jest w Towarzystwie skorygowaną metodą praw własności. Skorygowana metoda praw własności polega na wycenie udziałów kapitałowych posiadanych w podmiocie powiązanym na podstawie posiadanego udziału w nadwyżce aktywów nad zobowiązaniami. Dodatkowo, w wycenie tej od wartości jednostki powiązanej odlicza się wartość firmy i inne wartości niematerialne i prawne, które zostałyby wycenione w wartości zero wg zasad Solvency II.W bilansie statutowym Towarzystwo wycenia udziały metodą praw własności. Na dzień 31.12.2016 Towarzystwo nie dokonywało korekty na wycenie w zakresie omawianej pozycji w związku z założeniem, iż aktywa i zobowiązania w jednostce powiązanej nie wymagają istotnych korekt do wartości godziwej.D.1.5.2 Dłużne papiery wartościowe;10.10.2014;1;1;27;122
20;26.0;;D.1.4 Nieruchomości, maszyny i wyposażenie (rzeczowe aktywa trwałe) wykorzystywane na użytek własny;własnyTowarzystwo wycenia rzeczowe aktywa trwałe w wartości godziwej alternatywną metodą wyceny opisaną w punkcie D4.W bilansie statutowym środki trwałe są wyceniane w cenie nabycia lub koszcie wytworzenia, pomniejszonych o odpisy amortyzacyjne lub umorzeniowe oraz o odpisy z tytułu trwałej utraty wartości.D.1.5 Lokaty (inne niż aktywa dla ubezpieczeń na życie, w których;10.10.2014;1;1;27;122
21;26.0;;D.1.3 Aktywa z tytułu odroczonego podatku dochodowego;dochodowegoW bilansie ekonomicznym Towarzystwo rozpoznaje podatek odroczony w ujęciu netto jako aktywo lub rezerwę z tytułu odro-czonego podatku dochodowego. Podstawą do rozpoznania podatku odroczonego na bilansie ekonomicznym są dwa elementy.Pierwszym, bazowym składnikiem jest podatek odroczony rozpoznany w sprawozdaniu finansowym zgodnie z obowiązującymi w Towarzystwie zasadami rachunkowości. Drugim składnikiem podatku odroczonego na bilansie ekonomicznym są różnice przejściowe (korekty) pomiędzy bilansem, będącym częścią sprawozdania finansowego Towarzystwa, a bilansem ekonomicznym. W bilansie statutowym aktywa z tytułu odroczonego podatku oraz rezerwy na podatek odroczony wyceniane są z zasto-sowaniem stawek podatkowych, które według przewidywań będą obowiązywać w okresie, gdy składnik aktywów zostanie zrealizowany lub rezerwa rozwiązana, przyjmując za podstawę stawki podatkowe (i przepisy podatkowe) uchwalone na dzień bilansowy.D.1.4 Nieruchomości, maszyny i wyposażenie (rzeczowe aktywa trwałe);10.10.2014;1;1;27;122
22;26.0;;D.1.2 Wartości niematerialne i prawne;prawneW bilansie ekonomicznym Towarzystwo wycenia w wartości niezerowej wyłącznie te składniki wartości niematerialnych 49Sprawozdanie o wypłacalności i kondycji finansowej PKO Życie Towarzystwo Ubezpieczeń S.A.;10.10.2014;1;1;27;122
23;26.0;;D.1.1 Aktywowane koszty akwizycji;akwizycjiW bilansie ekonomicznym aktywowane koszty akwizycji w części przypadającej na przyszłe okresy sprawozdawcze wyceniane są w wartości zero. W bilansie statutowym koszty poniesione w okresie sprawozdawczym w części przypadającej na przyszłe okresy sprawozdawcze podlegają rozliczeniu w czasie i są wykazywane jako aktywowane koszty akwizycji. D.1.2 Wartości niematerialne i prawne;10.10.2014;1;1;27;122
24;12.0;;B.4.2 Opis realizacji funkcji zgodności z przepisami;"przepisamiFunkcja compliance realizowana jest Towarzystwie poprzez Biuro ds. Zgodności i Kontroli Wewnętrznej (BZKW). Zadania Biura zostały zdefiniowane w regulacjach wewnętrznych dot. ryzyka braku zgodności. Priorytety Biura na dany rok są określane w planie zatwierdzanym przez Zarząd i konsultowanym z Komitetem Audytu. Do procesów stale realizowanych przez Biuro lub z jego udziałem należą:• prowadzenie prac dostosowawczych związanych z nowymi regulacjami prawnymi i wymaganiami nadzorczymi,• ocena ryzyka braku zgodności, w tym w ramach procesu tworzenia produktów i materiałów marketingowych,• monitoring zgodności,• przegląd systemu zarządzania,• koordynowanie prac związanych z kontrolami zewnętrznych organów i wdrażaniem działań naprawczych,• rejestracja incydentów braku zgodności i ocena adekwatności podjętych działań naprawczych,• koordynacja procesu zapobiegania praniu pieniędzy i finansowania terroryzmu,• zarządzania sytuacjami konfliktu interesów, w tym inwestycji własnych pracowników towarzystwa,• prowadzenie rejestru korzyści i prezentów,• zapewnienie zgodności Spółki z wymaganiami regulacyjnymi w zakresie ochrony danych osobowych.W ramach procesu zapewnienia dostosowania do nowych regulacji prawnych BZKW współpracuje z Departamentem Praw-nym. Rolą BZKW jest identyfikacja zakresu prac wdrożeniowych, upewnienie się, że właściwe działania dostosowawcze zostały podjęte w Towarzystwie, raportowanie o statusie prac i ryzykach związanych z wdrożeniem do Zarządu i Rady Nadzorczej.W ramach dokonywania oceny ryzyka zgodności Towarzystwo realizuje 3 procesy:• samoocenę ryzyka braku zgodności na poziomie procesów – jest to analiza przeprowadzona w cyklu rocznym; proces ma charakter następczy,35Sprawozdanie o wypłacalności i kondycji finansowej PKO Życie Towarzystwo Ubezpieczeń S.A.";10.10.2014;1;1;27;122
