;ID_SEKCJA NADRZĘDNA;ID_SEKCJA;NAZWA_SEKCJI;TREŚĆ;DATA SFCR;WERSJA SFCR;KOD ZAKŁADU;KOD ZAKLADU;ID_TAB
84;31;35.0;E.4 Różnice między formułą standardową a stosowanym modelem wewnętrznym;Internal Model used ...................... 93;01.01.1970;1;1;85;101
85;31;34.0;E.3 Zastosowanie podmodułu ryzyka cen akcji opartego na duracji do obliczenia kapitałowego wymogu wypłacalności;Solvency;01.01.1970;1;1;85;101
86;31;33.0;E.2 Kapitałowy wymóg wypłacalności i minimalny wymóg kapitałowy;Requirement ............................... 92;01.01.1970;1;1;85;101
87;31;32.0;E.1 Środki własne;funds ................................................................................................................... 89;01.01.1970;1;1;85;101
88;25;30.0;D.5 Wszelkie inne informacje;information ................................................................................................. 88;01.01.1970;1;1;85;101
89;25;29.0;D.4 Alternatywne metody wyceny;for valuation ............................................................................... 88;01.01.1970;1;1;85;101
90;25;28.0;D.3 Inne zobowiązania;liabilities ............................................................................................................ 84;01.01.1970;1;1;85;101
91;25;27.0;D.2 Rezerwy techniczno-ubezpieczeniowe;Provisions .................................................................................................... 79;01.01.1970;1;1;85;101
92;25;26.0;D.1 Aktywa;Assets ......................................................................................................................... 72;01.01.1970;1;1;85;101
93;17;22.0;C.5 Ryzyko operacyjne;Risk .......................................................................................................... 69;01.01.1970;1;1;85;101
94;17;21.0;C.4 Ryzyko płynności;Risk ............................................................................................................... 66;01.01.1970;1;1;85;101
95;17;20.0;C.3 Ryzyko kredytowe;Risk ................................................................................................................... 62;01.01.1970;1;1;85;101
96;17;19.0;C.2 Ryzyko rynkowe;Risk ................................................................................................................. 56;01.01.1970;1;1;85;101
97;17;18.0;C.1 Ryzyko aktuarialne;Risk ........................................................................................................ 55;01.01.1970;1;1;85;101
98;8;15.0;B.7 Outsourcing of critical or important operational functions B.7.2.;following table relates CIFS and Key Functions that have been outsourced.;01.01.1970;1;1;85;101
99;8;13.0;B.5 Funkcja audytu wewnętrznego;Function ................................................................................................ 42;01.01.1970;1;1;85;101
100;8;12.0;B.4 System kontroli wewnętrznej;system ................................................................................................ 33;01.01.1970;1;1;85;101
101;8;11.0;B.3 System zarządzania ryzykiem, w tym własna ocena ryzyka i wypłacalności;assessment ................... 23;01.01.1970;1;1;85;101
102;8;10.0;B.2 Wymogi dotyczące kompetencji i reputacji;........................................................................................ 17;01.01.1970;1;1;85;101
103;8;9.0;B.1 Informacje ogólne o systemie zarządzania;system of governance ....................................................... 12;01.01.1970;1;1;85;101
104;2;7.0;A.5 Wszelkie inne informacje;information ................................................................................................. 11;01.01.1970;1;1;85;101
105;2;6.0;A.4 Wyniki z pozostałych rodzajów działalności;.................................................................................... 11;01.01.1970;1;1;85;101
106;2;5.0;A.3 Wynik z działalności lokacyjnej;10;01.01.1970;1;1;85;101
107;2;4.0;A.2 Wynik z działalności ubezpieczeniowej;8;01.01.1970;1;1;85;101
108;2;3.0;A.1 Działalność;Business ........................................................................................................................ 7;01.01.1970;1;1;85;101
